adult,backdrop_path,genre_ids,id,original_language,original_title,overview,popularity,poster_path,release_date,title,video,vote_average,vote_count
False,/htuuuEwAvDVECMpb0ltLLyZyDDt.jpg,"[18, 80]",238,en,The Godfather,"Spanning the years 1945 to 1955, a chronicle of the fictional Italian-American Corleone crime family. When organized crime family patriarch, Vito Corleone barely survives an attempt on his life, his youngest son, Michael steps in to take care of the would-be killers, launching a campaign of bloody revenge.",26.3032,/3bhkrj58Vtu7enYsRolD1fZdja1.jpg,1972-03-14,The Godfather,False,8.686,21758
False,/2u7zbn8EudG6kLlBzUYqP8RyFU4.jpg,"[12, 14, 28]",122,en,The Lord of the Rings: The Return of the King,"As armies mass for a final battle that will decide the fate of the world--and powerful, ancient forces of Light and Dark compete to determine the outcome--one member of the Fellowship of the Ring is revealed as the noble heir to the throne of the Kings of Men. Yet, the sole hope for triumph over evil lies with a brave hobbit, Frodo, who, accompanied by his loyal friend Sam and the hideous, wretched Gollum, ventures deep into the very dark heart of Mordor on his seemingly impossible quest to destroy the Ring of Power.​",21.869,/rCzpDGLbOoPwLjy3OAm5NUPOTrC.jpg,2003-12-17,The Lord of the Rings: The Return of the King,False,8.489,25383
False,/kGzFbGhp99zva6oZODW5atUtnqi.jpg,"[18, 80]",240,en,The Godfather Part II,"In the continuing saga of the Corleone crime family, a young Vito Corleone grows up in Sicily and in 1910s New York. In the 1950s, Michael Corleone attempts to expand the family business into Las Vegas, Hollywood and Cuba.",16.0727,/hek3koDUyRQk7FIhPXsa6mT2Zc3.jpg,1974-12-20,The Godfather Part II,False,8.571,13136
False,/enNubozHn9pXi0ycTVYUWfpHZm.jpg,"[18, 28, 80, 53]",155,en,The Dark Knight,"Batman raises the stakes in his war on crime. With the help of Lt. Jim Gordon and District Attorney Harvey Dent, Batman sets out to dismantle the remaining criminal organizations that plague the streets. The partnership proves to be effective, but they soon find themselves prey to a reign of chaos unleashed by a rising criminal mastermind known to the terrified citizens of Gotham as the Joker.",29.6884,/qJ2tW6WMUDux911r6m7haRef0WH.jpg,2008-07-16,The Dark Knight,False,8.522,34279
False,/bxgTSUenZDHNFerQ1whRKplrMKF.jpg,[18],389,en,12 Angry Men,"The defense and the prosecution have rested and the jury is filing into the jury room to decide if a young Spanish-American is guilty or innocent of murdering his father. What begins as an open and shut case soon becomes a mini-drama of each of the jurors' prejudices and preconceptions about the trial, the accused, and each other.",15.8026,/ow3wq89wM8qd5X7hWKxiRfsFf9C.jpg,1957-04-10,12 Angry Men,False,8.548,9348
False,/suaEOtk1N1sgg2MTM7oZd2cfVp3.jpg,"[53, 80, 35, 18]",680,en,Pulp Fiction,"A burger-loving hit man, his philosophical partner, a drug-addled gangster's moll and a washed-up boxer converge in this sprawling, comedic crime caper. Their adventures unfurl in three stories that ingeniously trip back and forth in time.",19.0439,/vQWk5YBFWF4bZaofAbv0tShwBvQ.jpg,1994-09-10,Pulp Fiction,False,8.487,28999
False,/gqby0RhyehP3uRrzmdyUZ0CgPPe.jpg,"[28, 878, 12]",27205,en,Inception,"Cobb, a skilled thief who commits corporate espionage by infiltrating the subconscious of his targets is offered a chance to regain his old life as payment for a task considered to be impossible: ""inception"", the implantation of another person's idea into a target's subconscious.",28.49,/ljsZTbVsrQSqZgWeep2B1QiDKuh.jpg,2010-07-15,Inception,False,8.37,37837
False,/zb6fM1CX41D9rF9hdgclu0peUmy.jpg,"[18, 36, 10752]",424,en,Schindler's List,The true story of how businessman Oskar Schindler saved over a thousand Jewish lives from the Nazis while they worked as slaves in his factory during World War II.,12.8867,/sF1U4EUQS8YHUYjNl3pMGNIQyr0.jpg,1993-12-15,Schindler's List,False,8.565,16656
False,/a0lfia8tk8ifkrve0Tn8wkISUvs.jpg,"[12, 14, 28]",120,en,The Lord of the Rings: The Fellowship of the Ring,"Young hobbit Frodo Baggins, after inheriting a mysterious ring from his uncle Bilbo, must leave his home in order to keep it from falling into the hands of its evil creator. Along the way, a fellowship is formed to protect the ringbearer and make sure that the ring arrives at its final destination: Mt. Doom, the only place where it can be destroyed.",25.0177,/6oom5QYQ2yQTMJIbnvbkBL9cHo6.jpg,2001-12-18,The Lord of the Rings: The Fellowship of the Ring,False,8.424,26297
False,/hZkgoQYus5vegHoetLkCJzb17zJ.jpg,"[18, 53]",550,en,Fight Club,"A ticking-time-bomb insomniac and a slippery soap salesman channel primal male aggression into a shocking new form of therapy. Their concept catches on, with underground ""fight clubs"" forming in every town, until an eccentric gets in the way and ignites an out-of-control spiral toward oblivion.",18.245,/jSziioSwPVrOy9Yow3XhWIBDjq1.jpg,1999-10-15,Fight Club,False,8.438,30648
False,/67HggiWaP9ZLv5sPYmyRV37yAJM.jpg,"[35, 18, 10749]",13,en,Forrest Gump,"A man with a low IQ has accomplished great things in his life and been present during significant historic events—in each case, far exceeding what anyone imagined he could do. But despite all he has achieved, his one true love eludes him.",16.5736,/arw2vcBveWOVZr6pxd9XTd1TdQa.jpg,1994-06-23,Forrest Gump,False,8.465,28546
False,/x4biAVdPVCghBlsVIzB6NmbghIz.jpg,[37],429,it,"Il buono, il brutto, il cattivo","While the Civil War rages on between the Union and the Confederacy, three men – a quiet loner, a ruthless hitman, and a Mexican bandit – comb the American Southwest in search of a strongbox containing $200,000 in stolen gold.",12.2084,/bX2xnavhMYjWDoZp1VM6VnU1xwe.jpg,1966-12-22,"The Good, the Bad and the Ugly",False,8.465,9132
False,/mshaKLtPUxcDBhzau6qiObEblhL.jpg,"[12, 14, 28]",121,en,The Lord of the Rings: The Two Towers,"Frodo Baggins and the other members of the Fellowship continue on their sacred quest to destroy the One Ring--but on separate paths. Their destinies lie at two towers--Orthanc Tower in Isengard, where the corrupt wizard Saruman awaits, and Sauron's fortress at Barad-dur, deep within the dark lands of Mordor. Frodo and Sam are trekking to Mordor to destroy the One Ring of Power while Gimli, Legolas and Aragorn search for the orc-captured Merry and Pippin. All along, nefarious wizard Saruman awaits the Fellowship members at the Orthanc Tower in Isengard.",18.5439,/5VTN0pR8gcqV3EPUHHfMGnJYN9L.jpg,2002-12-18,The Lord of the Rings: The Two Towers,False,8.409,22843
False,/7TF4p86ZafnxFuNqWdhpHXFO244.jpg,"[18, 80]",769,en,GoodFellas,"The true story of Henry Hill, a half-Irish, half-Sicilian Brooklyn kid who is adopted by neighbourhood gangsters at an early age and climbs the ranks of a Mafia family under the guidance of Jimmy Conway.",14.3313,/aKuFiU82s5ISJpGZp7YkIr3kCUd.jpg,1990-09-12,GoodFellas,False,8.455,13563
False,/8K9qHeM6G6QjQN0C5XKFGvK5lzM.jpg,"[28, 878]",603,en,The Matrix,"Set in the 22nd century, The Matrix tells the story of a computer hacker who joins a group of underground insurgents fighting the vast and powerful computers who now rule the earth.",20.1435,/p96dm7sCMn4VYAStA6siNz30G1r.jpg,1999-03-31,The Matrix,False,8.231,26703
False,/kgjvZgs6cV2v5bigzzzWqJ9EMGs.jpg,"[12, 28, 878]",1891,en,The Empire Strikes Back,"The epic saga continues as Luke Skywalker, in hopes of defeating the evil Galactic Empire, learns the ways of the Jedi from aging master Yoda. But Darth Vader is more determined than ever to capture Luke. Meanwhile, rebel leader Princess Leia, cocky Han Solo, Chewbacca, and droids C-3PO and R2-D2 are thrown into various stages of capture, betrayal and despair.",10.3024,/nNAeTmF4CtdSgMDplXTDPOpYzsX.jpg,1980-05-20,The Empire Strikes Back,False,8.395,17617
False,/vMylmakO2K9cZexNUze8wa9muJp.jpg,[18],510,en,One Flew Over the Cuckoo's Nest,"A petty criminal fakes insanity to serve his sentence in a mental ward rather than prison. He soon finds himself as a leader to the other patients—and an enemy to the cruel, domineering nurse who runs the ward.",6.6627,/kjWsMh72V6d8KRLV4EOoSJLT1H7.jpg,1975-11-19,One Flew Over the Cuckoo's Nest,False,8.414,10905
False,/hiKmpZMGZsrkA3cdce8a7Dpos1j.jpg,"[35, 53, 18]",496243,ko,기생충,"All unemployed, Ki-taek's family takes peculiar interest in the wealthy and glamorous Parks for their livelihood until they get entangled in an unexpected incident.",19.3225,/7IiTTgloJzvGI1TAYymCfbfl3vT.jpg,2019-05-30,Parasite,False,8.498,19399
False,/uWVkEo9PWHu9algZsiLPi6sRU64.jpg,"[36, 18]",556574,en,Hamilton,"Presenting the tale of American founding father Alexander Hamilton, this filmed version of the original Broadway smash hit is the story of America then, told by America now.",5.7199,/h1B7tW0t399VDjAcWJh8m87469b.jpg,2025-09-04,Hamilton,False,0.0,0
False,/yKxiCmJjZSMRpNxegO6s4zVsW4E.jpg,"[18, 28]",595228,ta,சூரரைப் போற்று,"Nedumaaran Rajangam ""Maara"" sets out to make the common man fly and in the process takes on the world's most capital intensive industry and several enemies who stand in his way.",2.6117,/5uimlxPCgAei8JfQUDFEUQLoyyh.jpg,2020-11-12,Soorarai Pottru,False,7.725,100
False,/vgnoBSVzWAV9sNQUORaDGvDp7wx.jpg,"[12, 18, 878]",157336,en,Interstellar,The adventures of a group of explorers who make use of a newly discovered wormhole to surpass the limitations on human space travel and conquer the vast distances involved in an interstellar voyage.,42.7807,/gEU2QniE6E77NI6lCU6MxlNBvIx.jpg,2014-11-05,Interstellar,False,8.46,37712
False,/ukfI9QkU1aIhOhKXYWE9n3z1mFR.jpg,"[16, 10751, 14]",129,ja,千と千尋の神隠し,"A young girl, Chihiro, becomes trapped in a strange new world of spirits. When her parents undergo a mysterious transformation, she must call upon the courage she never knew she had to free her family.",34.2894,/39wmItIWsg5sZMyRUHLkWBcuVCM.jpg,2001-07-20,Spirited Away,False,8.534,17414
False,/uvitbjFU4JqvMwIkMWHp69bmUzG.jpg,"[18, 80]",598,pt,Cidade de Deus,"In the poverty-stricken favelas of Rio de Janeiro in the 1970s, two young men choose different paths. Rocket is a budding photographer who documents the increasing drug-related violence of his neighborhood, while José “Zé” Pequeno is an ambitious drug dealer diving into a dangerous life of crime.",6.9757,/k7eYdWvhYQyRQoU2TB2A2Xu2TfD.jpg,2002-08-30,City of God,False,8.429,7762
False,/rW2xRFlJRbTnBJlQTSjQmjevIwb.jpg,"[18, 36, 10752]",857,en,Saving Private Ryan,"As U.S. troops storm the beaches of Normandy, three brothers lie dead on the battlefield, with a fourth trapped behind enemy lines. Ranger captain John Miller and seven men are tasked with penetrating German-held territory and bringing the boy home.",13.119,/uqx37cS8cpHg8U35f9U5IBlrCV3.jpg,1998-07-24,Saving Private Ryan,False,8.22,16470
False,/vxJ08SvwomfKbpboCWynC3uqUg4.jpg,"[14, 18, 80]",497,en,The Green Mile,"A supernatural tale set on death row in a Southern prison, where gentle giant John Coffey possesses the mysterious power to heal people's ailments. When the cell block's head guard, Paul Edgecomb, recognizes Coffey's miraculous gift, he tries desperately to help stave off the condemned man's execution.",16.0009,/8VG8fDNiy50H4FedGwdSVUPoaJe.jpg,1999-12-10,The Green Mile,False,8.503,18310
False,/6aNKD81RHR1DqUUa8kOZ1TBY1Lp.jpg,"[35, 18]",637,it,La vita è bella,A touching story of an Italian book seller of Jewish ancestry who lives in his own little fairy tale. His creative and happy life would come to an abrupt halt when his entire family is deported to a concentration camp during World War II. While locked up he tries to convince his son that the whole thing is just a game.,8.6868,/mfnkSeeVOBVheuyn2lo4tfmOPQb.jpg,1997-12-20,Life Is Beautiful,False,8.442,13498
False,/p1PLSI5Nw2krGxD7X4ulul1tDAk.jpg,"[80, 9648, 53]",807,en,Se7en,"Two homicide detectives are on a desperate hunt for a serial killer whose crimes are based on the ""seven deadly sins"" in this dark and haunting film that takes viewers from the tortured remains of one victim to the next. The seasoned Det. Somerset researches each sin in an effort to get inside the killer's mind, while his novice partner, Mills, scoffs at his efforts to unravel the case.",20.3085,/191nKfP0ehp3uIvWqgPbFmI4lv9.jpg,1995-09-22,Se7en,False,8.376,22003
False,/aYcnDyLMnpKce1FOYUpZrXtgUye.jpg,"[80, 53, 18]",274,en,The Silence of the Lambs,"Clarice Starling is a top student at the FBI's training academy.  Jack Crawford wants Clarice to interview Dr. Hannibal Lecter, a brilliant psychiatrist who is also a violent psychopath, serving life behind bars for various acts of murder and cannibalism.  Crawford believes that Lecter may have insight into a case and that Starling, as an attractive young woman, may be just the bait to draw him out.",3.1474,/uS9m8OBk1A8eM9I042bx8XXpqAq.jpg,1991-02-14,The Silence of the Lambs,False,8.346,17039
False,/2w4xG178RpB4MDAIfTkqAuSJzec.jpg,"[12, 28, 878]",11,en,Star Wars,Princess Leia is captured and held hostage by the evil Imperial forces in their effort to take over the galactic Empire. Venturesome Luke Skywalker and dashing captain Han Solo team together with the loveable robot duo R2-D2 and C-3PO to rescue the beautiful princess and restore peace and justice in the Empire.,15.9017,/6FfCtAuVAW8XJjZ7eWeLibRLWTw.jpg,1977-05-25,Star Wars,False,8.205,21409
False,,[],1328550,en,Seppuku,"Tamlyn Tomita stars as a concerned mother in this very dramatic film about raising an Olympian. Well acted by her and the cast there is so much rift between the daughter and Mom it is very good at instigated her Olympic dreams further. With the passion to do better in life, the daughter has to pull through her medical treatments and be heroine for so many people.  Watch it on Montageplay.com streaming platform",0.0286,/7VMh9jkgiUQhiXVV374k4usUHig.jpg,,Seppuku,False,0.0,0
False,/8uUa1fCfU4RZUX5E2husr0kJNHT.jpg,[35],318635,cn,大富之家,"This 1994 Chinese New Year offering takes place over a period of time between one Christmas and Chinese New Year's eve. We are introduced to thirteen ""Big Rich"" people, learn of their particular dispositions and dilemmas, are witness to the former either getting changed or developed and see the latter (re)solved. Teresa Mo as the daughter just returned from studying in France; Leslie Cheung as the friend who came in tow; Tony Leung Kar Fai as the cartoonist son who can only speak normally when he is anxious; Anita Yuen as the woman who Tony Leung's character falls in love with; Carol ""Do Do"" Cheng as her flat-chested, disciplinary-cum-art teacher sister; Raymond Wong as the eldest son who cannot handle alcohol well; Petrina Fung Bo Bo as his estranged wife; Sean Lau as the marriage-minded cousin; and Kwan Tak Hing as the eccentric-but-definitely-not-senile grandfather.",2.2201,/gfcBhy6eKknXLC3oVGXVfdChpAn.jpg,1994-02-06,It's a Wonderful Life,False,5.6,15
False,/gZWl93sf8AxavYpVT1Un6EF3oCj.jpg,"[80, 53, 18]",475557,en,Joker,"During the 1980s, a failed stand-up comedian is driven insane and turns to a life of crime and chaos in Gotham City while becoming an infamous psychopathic crime figure.",19.4534,/udDclJoHjfjb8Ekgsd4FDteOkCU.jpg,2019-10-01,Joker,False,8.133,26712
False,/qvZ91FwMq6O47VViAr8vZNQz3WI.jpg,"[28, 18]",346,ja,七人の侍,"A samurai answers a village's request for protection after he falls on hard times. The town needs protection from bandits, so the samurai gathers six others to help him teach the people how to defend themselves, and the villagers provide the soldiers with food.",6.1804,/lOMGc8bnSwQhS4XyE1S99uH8NXf.jpg,1954-04-26,Seven Samurai,False,8.456,3968
False,/bF8eIIIJJoMZf2mFibAejqEGQcX.jpg,"[18, 10402]",244786,en,Whiplash,"Under the direction of a ruthless instructor, a talented young drummer begins to pursue perfection at any cost, even his humanity.",15.8694,/7fn624j5lj3xTme2SgiLCeuedmO.jpg,2014-10-10,Whiplash,False,8.377,15855
False,,"[35, 18]",1300792,hi,The Intouchables,A true story of two men who should never have met – a quadriplegic aristocrat who was injured in a paragliding accident and a young man from the projects.,1.192,,,The Intouchables,False,0.0,0
False,/6WRrGYalXXveItfpnipYdayFkQB.jpg,"[18, 53, 80]",1422,en,The Departed,"To take down South Boston's Irish Mafia, the police send in one of their own to infiltrate the underworld, not realizing the syndicate has done likewise. While an undercover cop curries favor with the mob kingpin, a career criminal rises through the police ranks. But both sides soon discover there's a mole among them.",11.6269,/nT97ifVT2J1yMQmeq20Qblg61T.jpg,2006-10-04,The Departed,False,8.16,15477
False,/yCnJT53HMXAK87xzPAdjdYhZ3JE.jpg,"[18, 9648, 878]",1124,en,The Prestige,"A mysterious story of two magicians whose intense rivalry leads them on a life-long battle for supremacy -- full of obsession, deceit and jealousy with dangerous and deadly consequences.",14.583,/2ZOzyhoW08neG27DVySMCcq2emd.jpg,2006-10-17,The Prestige,False,8.204,16733
False,/1XqIhsqnAozznGhxlGdI0GPcCro.jpg,"[18, 10752]",423,en,The Pianist,"The true story of pianist Władysław Szpilman's experiences in Warsaw during the Nazi occupation. When the Jews of the city find themselves forced into a ghetto, Szpilman finds work playing in a café; and when his family is deported in 1942, he stays behind, works for a while as a laborer, and eventually goes into hiding in the ruins of the war-torn city.",7.8606,/2hFvxCCWrTmCYwfy7yum0GKRi3Y.jpg,2002-09-17,The Pianist,False,8.381,9644
False,/jhk6D8pim3yaByu1801kMoxXFaX.jpg,"[28, 18, 12]",98,en,Gladiator,"After the death of Emperor Marcus Aurelius, his devious son takes power and demotes Maximus, one of Rome's most capable generals who Marcus preferred. Eventually, Maximus is forced to become a gladiator and battle to the death against other men for the amusement of paying audiences.",18.3761,/ty8TGRuvJLPUmAR1H1nRIsgwvim.jpg,2000-05-04,Gladiator,False,8.221,19983
False,/6qHI1IYj7QlLSCwHRzkL62X175s.jpg,[18],73,en,American History X,"Derek Vineyard is paroled after serving 3 years in prison for killing two African-American men. Through his brother, Danny Vineyard's narration, we learn that before going to prison, Derek was a skinhead and the leader of a violent white supremacist gang that committed acts of racial crime throughout L.A. and his actions greatly influenced Danny. Reformed and fresh out of prison, Derek severs contact with the gang and becomes determined to keep Danny from going down the same violent path as he did.",5.6915,/x2drgoXYZ8484lqyDj7L1CEVR4T.jpg,1998-07-01,American History X,False,8.335,11995
False,/jynfI114q3kOAbIiVjVfFFmttU2.jpg,"[80, 18, 28]",101,fr,Léon,"Léon, the top hit man in New York, has earned a rep as an effective ""cleaner"". But when his next-door neighbors are wiped out by a loose-cannon DEA agent, he becomes the unwilling custodian of 12-year-old Mathilda. Before long, Mathilda's thoughts turn to revenge, and she considers following in Léon's footsteps.",10.3144,/bxB2q91nKYp8JNzqE7t7TWBVupB.jpg,1994-09-14,Léon: The Professional,False,8.3,15395
False,/9jrHaaXWB37VcA4KGemP8iF7bFB.jpg,"[18, 80, 53]",629,en,The Usual Suspects,"Held in an L.A. interrogation room, Verbal Kint attempts to convince the feds that a mythic crime lord, Keyser Soze, not only exists, but was also responsible for drawing him and his four partners into a multi-million dollar heist that ended with an explosion in San Pedro harbor – leaving few survivors. Verbal lures his interrogators with an incredible story of the crime lord's almost supernatural prowess.",9.7556,/99X2SgyFunJFXGAYnDv3sb9pnUD.jpg,1995-07-19,The Usual Suspects,False,8.173,10822
False,/vINgGecnz95iDL6fjQMARDsocgG.jpg,"[28, 53, 878]",280,en,Terminator 2: Judgment Day,"Ten years after the events of the original, a reprogrammed T-800 is sent back in time to protect young John Connor from the shape-shifting T-1000. Together with his mother Sarah, he fights to stop Skynet from triggering a nuclear apocalypse.",13.428,/weVXMD5QBGeQil4HEATZqAkXeEc.jpg,1991-07-03,Terminator 2: Judgment Day,False,8.13,13510
False,/wXsQvli6tWqja51pYxXNG1LFIGV.jpg,"[10751, 16, 18, 14, 12]",8587,en,The Lion King,"Young lion prince Simba, eager to one day become king of the Pride Lands, grows up under the watchful eye of his father Mufasa; all the while his villainous uncle Scar conspires to take the throne for himself. Amid betrayal and tragedy, Simba must confront his past and find his rightful place in the Circle of Life.",16.9971,/sKCr78MXSLixwmZ8DyJLrpMsd15.jpg,1994-06-15,The Lion King,False,8.256,18963
False,/zoVeIgKzGJzpdG6Gwnr7iOYfIMU.jpg,"[18, 10749]",11216,it,Nuovo Cinema Paradiso,"A filmmaker recalls his childhood, when he fell in love with the movies at his village's theater and formed a deep friendship with the theater's projectionist.",4.6304,/gCI2AeMV4IHSewhJkzsur5MEp6R.jpg,1988-11-17,Cinema Paradiso,False,8.434,4587
False,,[99],1520993,ja,火垂るの墓と高畑勲と7冊のノート,"NHK documentary about ""Grave of the Fireflies"" and 7 notebooks written by Isao Takahata that were found after his death. The film was based on a novel, but also on the director's personal experience, who fled the bombings with his sister.",0.3547,,2025-08-02,Hotaru no Haka to Takahata Isao to 7-satsu no Nōto,False,0.0,0
False,/yz8QL8WFD8yj0LA5zIlNOgcHvZK.jpg,"[12, 35, 878]",105,en,Back to the Future,"Eighties teenager Marty McFly is accidentally sent back in time to 1955, inadvertently disrupting his parents' first meeting and attracting his mother's romantic interest. Marty must repair the damage to history by rekindling his parents' romance and - with the help of his eccentric inventor friend Doc Brown - return to 1985.",14.019,/vN5B5WgYscRGcQpVhHl6p9DDTP0.jpg,1985-07-03,Back to the Future,False,8.322,20801
False,/uif5fUshJrXyyDzfpzp1DLw3N0S.jpg,"[27, 53, 9648]",539,en,Psycho,"When larcenous real estate clerk Marion Crane goes on the lam with a wad of cash and hopes of starting a new life, she ends up at the notorious Bates Motel, where manager Norman Bates cares for his housebound mother.",9.3023,/yz4QVqPx3h1hD1DfqqQkCq3rmxW.jpg,1960-06-22,Psycho,False,8.422,10475
False,/fccEQecqrOxrczFnq35OxGQfCXi.jpg,"[18, 37]",335,it,C'era una volta il West,"As the railroad builders advance unstoppably through the Arizona desert on their way to the sea, Jill arrives in the small town of Flagstone with the intention of starting a new life.",7.4829,/qbYgqOczabWNn2XKwgMtVrntD6P.jpg,1968-12-21,Once Upon a Time in the West,False,8.3,4600
False,,[16],1386711,et,Casablanca,"Paul and Mary fall in love in the pottery factory. However, the seemingly innocent clay mugs have their own vision of the budding romance. By manipulating with lively messages, the mugs take it upon themselves to decide the fate of the characters.",0.2365,/rG3aWYbYW5t5lq7sKKuXYhBuw7X.jpg,2024-11-20,Casablanca,False,0.0,0
False,/kSlO1pHpwQfPQdgVPr7dJiJNtJ8.jpg,"[35, 18, 10749]",3082,en,Modern Times,"A bumbling tramp desires to build a home with a young woman, yet is thwarted time and time again by his lack of experience and habit of being in the wrong place at the wrong time..",1.847,/7uoiKOEjxBBW0AgDGQWrlfGQ90w.jpg,1936-02-05,Modern Times,False,8.281,3869
False,/Ma7mQsldFCaQpsZbm8zolgLfmV.jpg,"[35, 18, 10749]",901,en,City Lights,A tramp falls in love with a beautiful blind flower girl. His on-and-off friendship with a wealthy man allows him to be the girl's benefactor and suitor.,2.5808,/ugmakEL5y294I5bXgiBqApuZpwc.jpg,1931-02-06,City Lights,False,8.265,2308
False,,[],1447820,fr,Capharnaüm,,0.0871,,,Capharnaüm,False,0.0,0
False,/6EbxuGgAjizKqd9CmG5HG0m0t23.jpg,"[18, 10752, 36]",472454,tr,Ayla,"In 1950, amidst the ravages of the Korean War, Sergeant Süleyman stumbles upon a a half-frozen little girl, with no parents and no help in sight and he risks his own life to save her, smuggling her into his army base and out of harm’s way.",1.7846,/jb7oT0nNiLElnmBC01lMm2GaR26.jpg,2017-10-27,Ayla: The Daughter of War,False,8.0,376
False,/bOUKDbOe7hxGUHQHYJ7VCKkziZ3.jpg,"[28, 53, 80, 12]",432139,ta,விக்ரம் வேதா,A notorious gangster Vedha surrenders himself to encounter specialist Vikram whom he challenges every step of the way by narrating his life events in the form of riddles that needs to be solved in order to capture him.,2.1493,/ob9YxdzRu5lfKgz0PNrlL45dorf.jpg,2017-07-21,Vikram Vedha,False,7.288,203
False,/8x9iKH8kWA0zdkgNdpAew7OstYe.jpg,"[16, 10749, 18]",372058,ja,君の名は。,"High schoolers Mitsuha and Taki are complete strangers living separate lives. But one night, they suddenly switch places. Mitsuha wakes up in Taki’s body, and he in hers. This bizarre occurrence continues to happen randomly, and the two must adjust their lives around each other.",19.1591,/q719jXXEzOoYaps6babgKnONONX.jpg,2016-08-26,Your Name.,False,8.481,11935
False,/l0fNAHLOFReQJsxCOmGWvJDnimn.jpg,"[18, 10751, 35]",360814,hi,दंगल,"Dangal is an extraordinary true story based on the life of Mahavir Singh and his two daughters, Geeta and Babita Phogat. The film traces the inspirational journey of a father who trains his daughters to become world class wrestlers.",3.0553,/cJRPOLEexI7qp2DKtFfCh7YaaUG.jpg,2016-12-21,Dangal,False,7.89,1056
False,/8mnXR9rey5uQ08rZAvzojKWbDQS.jpg,"[16, 28, 12, 878]",324857,en,Spider-Man: Into the Spider-Verse,"Struggling to find his place in the world while juggling school and family, Brooklyn teenager Miles Morales is unexpectedly bitten by a radioactive spider and develops unfathomable powers just like the one and only Spider-Man. While wrestling with the implications of his new abilities, Miles discovers a super collider created by the madman Wilson ""Kingpin"" Fisk, causing others from across the Spider-Verse to be inadvertently transported to his dimension.",18.2247,/iiZZdoQBEYBv6id8su7ImL0oCbD.jpg,2018-12-06,Spider-Man: Into the Spider-Verse,False,8.397,16379
