adult,backdrop_path,genre_ids,id,original_language,original_title,overview,popularity,poster_path,release_date,title,video,vote_average,vote_count
False,/tcZi0LQc5iu2u6i5aOWyj9NBBvl.jpg,"[18, 10749]",80,en,Before Sunset,"Nine years later, Jesse travels across Europe giving readings from a book he wrote about the night he spent in Vienna with Celine. After his reading in Paris, Celine finds him, and they spend part of the day together before Jesse has to again leave for a flight. They are both in relationships now, and Jesse has a son, but as their strong feelings for each other start to return, both confess a longing for more.",3.9773,/94Yl2xVB7YIRK4IgA0RqYGiNgkB.jpg,2004-06-16,Before Sunset,False,7.809,3548
False,/smaFFzbd1flJKUqDI2ylljQ8Pki.jpg,"[35, 18]",19625,hi,मुन्ना भाई एम बी बी एस,A gangster sets out to fulfill his father's dream of becoming a doctor.,2.221,/nZNUTxGsSB4nLEC9Bpa2xfu81qV.jpg,2003-12-19,Munna Bhai M.B.B.S.,False,7.189,318
False,/27dhih2lFlBl0oIUE9jFwIEBIMg.jpg,"[18, 10749]",14752,hi,दिल चाहता है,"Three inseparable childhood friends are just out of college. Nothing comes between them - until they each fall in love, and their wildly different approaches to relationships creates tension.",1.9584,/d5yjk7hbv8AK0DR0oJUrSGHMn9A.jpg,2001-07-24,Dil Chahta Hai,False,6.839,305
False,/2NArMoObkAbnIPvqlHC3gRGsfBb.jpg,"[80, 18, 53]",11423,ko,살인의 추억,"During the late 1980s, two detectives in a South Korean province attempt to solve the nation's first series of rape-and-murder cases.",6.2247,/jcgUjx1QcupGzjntTVlnQ15lHqy.jpg,2003-04-25,Memories of Murder,False,8.062,4160
False,/p3WiF8qYS7Qp17YRYgrFh7gf9P9.jpg,"[28, 80]",24,en,Kill Bill: Vol. 1,"An assassin is shot by her ruthless employer, Bill, and other members of their assassination circle – but she lives to plot her vengeance.",9.7761,/v7TaX8kXMXs5yFFGR41guUDNcnB.jpg,2003-10-10,Kill Bill: Vol. 1,False,7.971,18078
False,/eCynaAOgYYiw5yN5lBwz3IxqvaW.jpg,"[16, 10751]",12,en,Finding Nemo,"Nemo, an adventurous young clownfish, is unexpectedly taken from his Great Barrier Reef home to a dentist's office aquarium. It's up to his worrisome father Marlin and a friendly but forgetful fish Dory to bring Nemo home -- meeting vegetarian sharks, surfer dude turtles, hypnotic jellyfish, hungry seagulls, and more along the way.",13.3835,/eHuGQ10FUzK1mdOY69wF5pGgEf5.jpg,2003-05-30,Finding Nemo,False,7.817,19856
False,/Ag6qhzsJd3k1NKuNrG9RmhZDMh7.jpg,"[18, 80]",640,en,Catch Me If You Can,"A true story about Frank Abagnale Jr. who, before his 19th birthday, successfully conned millions of dollars worth of checks as a Pan Am pilot, doctor, and legal prosecutor. An FBI agent makes it his mission to put him behind bars. But Frank not only eludes capture, he revels in the pursuit.",12.4963,/ctjEj2xM32OvBXCq8zAdK3ZrsAj.jpg,2002-12-16,Catch Me If You Can,False,7.979,16283
False,/tJTRLtdKPeVT8HORSbeHpdb8BKg.jpg,"[18, 53]",55,es,Amores perros,"A fatalistic car crash in Mexico city sets off a chain of events in the lives of three people: a supermodel, a young man wanting to run off with his sister-in-law, and a homeless man. Their lives are catapulted into unforeseen situations instigated by the seemingly inconsequential destiny of a dog.",3.0377,/n3QrQvLM7lZ9AGExvG89OREkCXW.jpg,2000-06-16,Amores Perros,False,7.628,2732
False,/c7VbRPlev1bRfKvTxr98erw5T7B.jpg,"[16, 35, 10751]",585,en,"Monsters, Inc.","Lovable Sulley and his wisecracking sidekick Mike Wazowski are the top scare team at Monsters, Inc., the scream-processing factory in Monstropolis. When a little girl named Boo wanders into their world, it's the monsters who are scared silly, and it's up to Sulley and Mike to keep her out of sight and get her back home.",15.456,/wFSpyMsp7H0ttERbxY7Trlv8xry.jpg,2001-11-01,"Monsters, Inc.",False,7.846,19051
False,/76VwduxQMkVXOUktps85dE0lLeP.jpg,"[12, 18, 36]",19666,hi,लगान,"In 1890s India, an arrogant British commander challenges the harshly taxed residents of Champaner to a high-stakes cricket match.",3.5062,/yNX9lFRAFeNLNRIXdqZK9gYrYKa.jpg,2001-06-15,Lagaan: Once Upon a Time in India,False,7.249,597
False,/xLMJCCSatxENpHO9rLW9yD8A12C.jpg,"[16, 878, 28, 18]",18491,ja,新世紀エヴァンゲリオン劇場版 Air／まごころを、君に,"SEELE orders an all-out attack on NERV, aiming to destroy the Evas before Gendo can advance his own plans for the Human Instrumentality Project. Shinji is pushed to the limits of his sanity as he is forced to decide the fate of humanity.",5.8798,/j6G24dqI4WgUtChhWjfnI4lnmiK.jpg,1997-07-19,Neon Genesis Evangelion: The End of Evangelion,False,8.269,1714
False,/6TjllWT3cGrPFyqDXurVZ3L8bBi.jpg,"[9648, 53, 18]",745,en,The Sixth Sense,"Following an unexpected tragedy, child psychologist Malcolm Crowe meets a nine year old boy named Cole Sear, who is hiding a dark secret.",9.8448,/vOyfUXNFSnaTk7Vk5AjpsKTUWsu.jpg,1999-08-06,The Sixth Sense,False,8.0,12200
False,/rmiG2uwcNoGFmBKMoa1pIcf514L.jpg,"[35, 18]",37165,en,The Truman Show,An insurance salesman begins to suspect that his whole life is actually some sort of reality TV show.,12.1762,/vuza0WqY239yBXOadKlGwJsZJFE.jpg,1998-06-04,The Truman Show,False,8.149,19221
False,/muSeX7fnNw0pv4zHK7RSwZln6Hk.jpg,"[18, 10402]",10376,it,La leggenda del pianista sull'oceano,"The story of a virtuoso piano player who lives his entire life aboard an ocean liner. Born and raised on the ship, 1900 learned about the outside world through interactions with passengers, never setting foot on land, even for the love of his life. Years later, the ship may be destroyed, and a former band member fears that 1900 may still be aboard, willing to go down with the ship.",3.0042,/iOcbJ5pxokOPDRgieVDbsFMrCc6.jpg,1998-10-28,The Legend of 1900,False,8.25,2339
False,/vx5Mla7OfNzibnVat2HQuqGrUkc.jpg,"[35, 10749, 80]",1075,sr,"Crna mačka, beli mačor","Matko is a small time hustler, living by the Danube with his 17-year-old son Zare. After a failed business deal he owes money to the much more successful gangster Dadan. Dadan has a sister, Afrodita, that he desperately wants to see get married so they strike a deal: Zare is to marry her.",2.1614,/xxQ9jgYf3xhbUTW98VtCjA1wMLv.jpg,1998-06-01,"Black Cat, White Cat",False,7.7,771
False,/ti6kJ80ZB8RZTiDIzPkhaCJMoqq.jpg,"[35, 80]",115,en,The Big Lebowski,"Jeffrey 'The Dude' Lebowski, a Los Angeles slacker who only wants to bowl and drink White Russians, is mistaken for another Jeffrey Lebowski, a wheelchair-bound millionaire, and finds himself dragged into a strange series of events involving nihilists, adult film producers, ferrets, errant toes, and large sums of money.",8.2136,/9mprbw31MGdd66LR0AQKoDMoFRv.jpg,1998-03-06,The Big Lebowski,False,7.838,11645
False,/wUc83y8kXNdRK66o0HU5X8eBri4.jpg,"[18, 80]",627,en,Trainspotting,"Hilarious but harrowing, the film charts the disintegration of the friendship between Renton, Spud, Sick Boy, Tommy and Begbie as they proceed seemingly towards a psychotic, drug-fuelled self-destruction.",5.1384,/1jUC02qsqS2NxBMFarbIhcQtazV.jpg,1996-02-23,Trainspotting,False,7.961,9982
False,/747dgDfL5d8esobk7h4odaOFhUq.jpg,"[80, 18, 53]",275,en,Fargo,"Jerry, a small-town Minnesota car salesman is bursting at the seams with debt... but he's got a plan. He's going to hire two thugs to kidnap his wife in a scheme to collect a hefty ransom from his wealthy father-in-law. It's going to be a snap and nobody's going to get hurt... until people start dying. Enter Police Chief Marge, a coffee-drinking, parka-wearing - and extremely pregnant - investigator who'll stop at nothing to get her man. And if you think her small-time investigative skills will give the crooks a run for their ransom... you betcha!",10.1917,/rt7cpEr1uP6RTZykBFhBTcRaKvG.jpg,1996-03-08,Fargo,False,7.851,8529
False,,[28],17318,en,Underground,"In the UK suburbs, an underground tournament is set to challenge twelve fighters from different backgrounds to compete for the price of £500,000. They have been handpicked for a no-holds barred competition that will push each fighter to their limit. Each fighter has their own reason for competing, and each will give everything they've got to take the prize...but there can be only one winner.",0.7231,/zaWVpk2COx93OHq9Vz41xl0Sij7.jpg,2007-01-01,Underground,False,4.2,14
False,/k61xLJgPo7ScxHLLiBzTM9IDaB7.jpg,[18],406,fr,La Haine,"After a chaotic night of rioting in a marginal suburb of Paris, three young friends, Vinz, Hubert and Saïd, wander around unoccupied waiting for news about the state of health of a mutual friend who has been seriously injured when confronting the police.",4.5473,/fFVWBMKLwwPh9K0hkrKwPUf8mwn.jpg,1995-05-31,La Haine,False,8.085,4268
False,/90ez6ArvpO8bvpyIngBuwXOqJm5.jpg,"[35, 18, 10749]",19404,hi,दिलवाले दुल्हनिया ले जायेंगे,"Raj is a rich, carefree, happy-go-lucky second generation NRI. Simran is the daughter of Chaudhary Baldev Singh, who in spite of being an NRI is very strict about adherence to Indian values. Simran has left for India to be married to her childhood fiancé. Raj leaves for India with a mission at his hands, to claim his lady love under the noses of her whole family. Thus begins a saga.",6.5822,/2CAL2433ZeIihfX1Hb2139CX0pW.jpg,1995-10-20,Dilwale Dulhania Le Jayenge,False,8.515,4504
False,/pZcoSJUb3Lgr9Rzg2shg1PtTBP9.jpg,"[18, 9648, 10749]",110,fr,Trois couleurs : Rouge,"Part-time model Valentine unexpectedly befriends a retired judge after she runs over his dog. At first, the grumpy man shows no concern about the dog, and Valentine decides to keep it. But the two form a bond when she returns to his house and catches him listening to his neighbors’ phone calls.",2.7043,/JHmsBiX1tjCKqAul1lzC20WcAW.jpg,1994-05-12,Three Colors: Red,False,7.912,1460
False,/qA2TyqPldTtoTVY3LKrNIG5g6bH.jpg,"[18, 10749]",76,en,Before Sunrise,"A young man and woman meet on a train in Europe, and wind up spending one evening together in Vienna. Unfortunately, both know that this will probably be their only night together.",6.2968,/kf1Jb1c2JAOqjuzA3H4oDM263uB.jpg,1995-01-27,Before Sunrise,False,7.966,4382
False,/jzt9HuhIAdH9qp0K2MA1m5V8sgq.jpg,"[12, 878]",329,en,Jurassic Park,"A wealthy entrepreneur secretly creates a theme park featuring living dinosaurs drawn from prehistoric DNA. Before opening day, he invites a team of experts and his two eager grandchildren to experience the park and help calm anxious investors. However, the park is anything but amusing as the security systems go off-line and the dinosaurs escape.",11.2759,/63viWuPfYQjRYLSZSZNq7dglJP5.jpg,1993-06-11,Jurassic Park,False,7.96,17045
False,/1GZVHgJUcVyytQRJ533GpMavAcL.jpg,[18],7984,en,In the Name of the Father,"A small-time Belfast thief, Gerry Conlon, is wrongly convicted of an IRA bombing in London, along with his father and friends, and spends 15 years in prison fighting to prove his innocence.",2.0525,/3NcIkKxaO2SmRVsG1v50XhtmL0f.jpg,1993-12-12,In the Name of the Father,False,7.9,1840
False,/vuglA60RqvpHK9rIcG8sXaiWw1L.jpg,"[18, 35, 10749]",11104,cn,重慶森林,"Two melancholic Hong Kong policemen fall in love: one with a mysterious underworld figure, the other with a beautiful and ethereal server at a late-night restaurant.",5.5867,/43I9DcNoCzpyzK8JCkJYpHqHqGG.jpg,1994-07-14,Chungking Express,False,8.0,1989
False,/bBiZN1epQTu3F8iFLBuMhc4TRzr.jpg,[18],10997,zh,霸王别姬,Two boys meet at an opera training school in Peking in 1924. Their resulting friendship will span nearly 70 years and endure some of the most troublesome times in China's history.,3.3573,/ySf9I93w6kJiaEb2T4zpoQjY8PR.jpg,1993-01-01,Farewell My Concubine,False,7.95,621
False,/9UCHfC9tYojD4mMVBm0boyzYEQq.jpg,[18],10404,zh,大红灯笼高高挂,"In 1920s China, 19-year-old Songlian becomes a concubine of a powerful lord and is forced to compete with his three wives for the privileges gained.",2.8791,/j6MGZpg55cTqlHHwahBtzI2qQg1.jpg,1991-12-18,Raise the Red Lantern,False,7.927,751
False,/hpzQHv8cA7j2Dn2CphOFYmllXzj.jpg,[18],207,en,Dead Poets Society,"At an elite, old-fashioned boarding school in New England, a passionate English teacher inspires his students to rebel against convention and seize the potential of every day, courting the disdain of the stern headmaster.",11.8698,/erzbMlcNHOdx24AXOcn2ZKA7R1q.jpg,1989-06-02,Dead Poets Society,False,8.301,11845
False,/yjGllQUm28R4X9xD9T5xMszirgw.jpg,"[80, 18]",235,en,Stand by Me,"After learning that a boy their age has been accidentally killed near their rural homes, four Oregon boys decide to go see the body. On the way, Gordie,  Vern, Chris and Teddy encounter a mean junk man and a marsh full of leeches, as they also learn more about one another and their very different home lives. Just a lark at first, the boys' adventure evolves into a defining event in their lives.",4.7989,/vz0w9BSehcqjDcJOjRaCk7fgJe7.jpg,1986-08-08,Stand by Me,False,7.852,6149
False,/wjt1dwtabVm9vujAteDTnXnpHfZ.jpg,"[18, 10752, 28]",792,en,Platoon,"As a young and naive recruit in Vietnam, Chris Taylor faces a moral crisis when confronted with the horrors of war and the duality of man.",9.287,/m3mmFkPQKvPZq5exmh0bDuXlD9T.jpg,1986-12-19,Platoon,False,7.748,4797
False,/fWrq3u16gaBJ6nYNWcR3XaOhQPq.jpg,[18],655,en,"Paris, Texas","A man wanders out of the desert not knowing who he is. His brother finds him, and helps to pull his memory back of the life he led before he walked out on his family and disappeared four years earlier.",4.3547,/sP27Qm4THyRZyHjHYMfIDtJP6YE.jpg,1984-07-16,"Paris, Texas",False,8.102,2028
False,/nrm4FH3Dl9D62B1Lj7dsQgkwXRa.jpg,"[10402, 18]",12104,en,Pink Floyd: The Wall,A troubled rock star descends into madness in the midst of his physical and social isolation from everyone.,2.4347,/aElHyIdF5jmctFGhlhhaPFsbBJC.jpg,1982-07-14,Pink Floyd: The Wall,False,7.95,1553
False,/ulVUa2MvnJAjAeRt7h23FFJVRKH.jpg,"[12, 16, 14]",81,ja,風の谷のナウシカ,"After a global war, the seaside kingdom known as the Valley of the Wind remains one of the last strongholds on Earth untouched by a poisonous jungle and the powerful insects that guard it. Led by the courageous Princess Nausicaä, the people of the Valley engage in an epic struggle to restore the bond between humanity and Earth.",5.3951,/tcrkfB8SRPQCgwI88hQScua6nxh.jpg,1984-03-11,Nausicaä of the Valley of the Wind,False,7.95,3801
False,/jaO8WurWoUBE55nskqtFqPZFFaO.jpg,"[27, 9648, 878]",1091,en,The Thing,"A twelve-man team at a remote Antarctic research station discovers an alien buried in the snow for over 100,000 years. Soon unfrozen, the form-changing creature wreaks havoc, creates terror...And becomes one of them.",7.3611,/tzGY49kseSE9QAKk47uuDGwnSCu.jpg,1982-06-25,The Thing,False,8.07,7407
False,/46iMqI1qzAtnXJxGRNCFwYNYqOo.jpg,"[18, 12]",9343,de,Fitzcarraldo,"Fitzcarraldo is a dreamer who plans to build an opera house in Iquitos, in the Peruvian Amazon, so, in order to finance his project, he embarks on an epic adventure to collect rubber, a very profitable product, in a remote and unexplored region of the rainforest.",3.2692,/oBCnYEKcg1rMhr5JjDnrRpilvDd.jpg,1982-03-02,Fitzcarraldo,False,7.625,814
False,/jVzoKlWUpsKV3y5oLafLQhEvgX6.jpg,"[14, 18, 9648]",5961,sv,Fanny och Alexander,"As children in the loving Ekdahl family, Fanny and Alexander enjoy a happy life with their parents, who run a theater company. After their father dies unexpectedly, however, the siblings end up in a joyless home when their mother, Emilie, marries a stern bishop. The bleak situation gradually grows worse as the bishop becomes more controlling, but dedicated relatives make a valiant attempt to aid Emilie, Fanny and Alexander.",1.6227,/q8jlA3Wc1Z987hNKRFA44g5OugC.jpg,1982-12-17,Fanny and Alexander,False,7.776,812
False,/qr7dUqleMRd0VgollazbmyP9XjI.jpg,"[878, 18, 53]",78,en,Blade Runner,"In the smog-choked dystopian Los Angeles of 2019, blade runner Rick Deckard is called out of retirement to terminate a quartet of replicants who have escaped to Earth seeking their creator for a way to extend their short life spans.",9.8035,/63N9uy8nd9j7Eog2axPQ8lbr3Wj.jpg,1982-06-25,Blade Runner,False,7.942,14314
False,/lOrM3OQhHlzEkpF7Ih3GghecrA8.jpg,[35],583,en,Life of Brian,"Brian Cohen is an average young Jewish man, but through a series of ridiculous events, he gains a reputation as the Messiah. When he's not dodging his followers or being scolded by his shrill mother, the hapless Brian has to contend with the pompous Pontius Pilate and acronym-obsessed members of a separatist movement. Rife with Monty Python's signature absurdity, the tale finds Brian's life paralleling Biblical lore, albeit with many more laughs.",4.0968,/lSSA64WF0M0BXnjwr2quMh6shCl.jpg,1979-08-17,Life of Brian,False,7.76,4636
False,/1YlaU9vXlD4K5EBGZKjaCb9rJb9.jpg,"[18, 36]",1955,en,The Elephant Man,"A Victorian surgeon rescues a heavily disfigured man being mistreated by his ""owner"" as a side-show freak. Behind his monstrous façade, there is revealed a person of great intelligence and sensitivity. Based on the true story of Joseph Merrick (called John Merrick in the film), a severely deformed man in 19th century London.",7.1111,/u0wpPYjuSt8DIe1Y3Vapnh8jcKE.jpg,1980-10-09,The Elephant Man,False,8.05,3710
False,/ojG57hVx69vhk5DDGPIcfyRR55I.jpg,"[18, 10752]",11778,en,The Deer Hunter,"A group of working-class friends decide to enlist in the Army during the Vietnam War and finds it to be hellish chaos -- not the noble venture they imagined. Before they left, Steven married his pregnant girlfriend -- and Michael and Nick were in love with the same woman. But all three are different men upon their return.",4.3268,/bbGtogDZOg09bm42KIpCXUXICkh.jpg,1978-12-08,The Deer Hunter,False,7.991,4002
False,/wC36tEU7AqP5llAvjXkZhZ248tX.jpg,[18],1366,en,Rocky,"Rocky Balboa is a Philadelphia club fighter who seems to be going nowhere. But when a stroke of fate puts him in the ring with a world heavyweight champion, Rocky knows that it's his one shot at the big time — a once-in-a-lifetime opportunity to go the distance and come out a winner!",9.0112,/8kEun6U9hTddM7NEfLLCGQKU2Mp.jpg,1976-11-20,Rocky,False,7.79,8205
False,/of6OQnsvPHXEASczrBc3nVsMZ7q.jpg,[18],10774,en,Network,"When veteran anchorman Howard Beale is forced to retire his 25-year post because of his age, he announces to viewers that he will kill himself during his farewell broadcast. Network executives rethink their decision when his fanatical tirade results in a spike in ratings.",3.6977,/gZ8hhuVEQ78CLND09trZJ45Eiy8.jpg,1976-11-14,Network,False,7.814,1869
False,/okdg55jhsr9k1F2lxsZoQncrLZL.jpg,"[18, 10749, 10752, 36]",3175,en,Barry Lyndon,"An Irish rogue uses his cunning and wit to work his way up the social classes of 18th century England, transforming himself from the humble Redmond Barry into the noble Barry Lyndon.",3.6213,/x2JQCgLjieWOwvImeGtLmuNgsrq.jpg,1975-12-18,Barry Lyndon,False,8.0,2982
False,/9UAcMhSCDJ2OCo5QdPpSERjhMA1.jpg,"[18, 36]",1396,ru,Зеркало,"A dying man in his forties recalls his childhood, his mother, the war and personal moments that tell of and juxtapose pivotal moments in Soviet history with daily life.",2.8312,/AttDP5OEsMxtHPPN7Z92p2Ntnmd.jpg,1975-03-07,Mirror,False,7.958,1013
False,/eJ6kPtua2rEvjxHdCtnIobXJZSf.jpg,"[80, 18, 9648, 53]",829,en,Chinatown,"Private eye Jake Gittes lives off of the murky moral climate of sunbaked, pre-World War II Southern California. Hired by a beautiful socialite to investigate her husband's extra-marital affair, Gittes is swept into a maelstrom of double dealings and deadly deceits, uncovering a web of personal and political scandals that come crashing together.",4.7504,/kZRSP3FmOcq0xnBulqpUQngJUXY.jpg,1974-06-20,Chinatown,False,7.918,4006
False,/2Cf8V0iQx0c52IxeLdxOvjI2bBf.jpg,"[35, 80, 18]",11293,en,Paper Moon,"During the Great Depression, a con man finds himself saddled with a young girl who may or may not be his daughter, and the two forge an unlikely partnership.",1.9054,/3GHG0kTcBWHKdXjj3RdK8GjBCd6.jpg,1973-05-09,Paper Moon,False,7.87,764
False,/znLq5iyuMVvHwDdgZf6HyVUNjWB.jpg,"[80, 53]",5511,fr,Le Samouraï,"After carrying out a flawlessly planned hit, Jef Costello, a contract killer with samurai instincts, finds himself caught between a persistent police investigator and a ruthless employer, and not even his armor of fedora and trench coat can protect him.",1.8623,/5Fa6o5nfUPEatQ9b3OwEvdEdR7T.jpg,1967-10-25,Le Samouraï,False,7.8,1166
False,/avjG5EPgWXyLvsUId6hEn0iqT4A.jpg,"[18, 878, 9648]",2103,en,Solaris,A troubled psychologist is sent to investigate the crew of an isolated research station orbiting a bizarre planet.,1.6893,/drdrB1hEZmzFlK1xtW5HMxK3LUJ.jpg,2002-11-27,Solaris,False,5.917,1358
False,/9TDi0FPOSAePfVLZXAUgFZhiMLf.jpg,"[18, 80]",903,en,Cool Hand Luke,"When petty criminal Luke Jackson is sentenced to two years in a Florida prison farm, he doesn't play by the rules of either the sadistic warden or the yard's resident heavy, Dragline, who ends up admiring the new guy's unbreakable will. Luke's bravado, even in the face of repeated stints in the prison's dreaded solitary confinement cell, ""the box,"" make him a rebel hero to his fellow convicts and a thorn in the side of the prison officers.",3.6489,/4ykzTiHKLamh3eZJ8orVICtU2Jp.jpg,1967-11-01,Cool Hand Luke,False,7.734,1498
False,/xmLgdb0yDBXa7Dlo3aCzjhjCkuE.jpg,[18],10238,sv,Viskningar och rop,"As Agnes slowly dies of cancer, her sisters are so immersed in their own psychic pains that they are unable to offer her the support she needs.",2.8187,/a1bMgB09YDvvRN9SitCclUYragr.jpg,1972-12-21,Cries and Whispers,False,7.903,730
False,/sj2aZDetPE8RoOCAm5QJitCNfLr.jpg,[18],797,sv,Persona,"A young nurse, Alma, is put in charge of Elisabeth Vogler: an actress who is seemingly healthy in all respects, but will not talk. As they spend time together, Alma speaks to Elisabeth constantly, never receiving any answer.",2.6519,/v2KsLNChpT6vLf0YFhkJmAtGkNq.jpg,1966-10-18,Persona,False,8.15,2290
False,/kIBBeb94FbNfLSljeFUxUoszflb.jpg,"[18, 10752, 36]",17295,it,La battaglia di Algeri,Tracing the struggle of the Algerian Front de Liberation Nationale to gain freedom from French colonial rule as seen through the eyes of Ali from his start as a petty thief to his rise to prominence in the organisation and capture by the French in 1957. The film traces the rebels' struggle and the increasingly extreme measures taken by the French government to quell the revolt.,1.349,/2p3AFtOHFvP6OeVMqlnL1zLKOqL.jpg,1966-09-08,The Battle of Algiers,False,7.9,823
False,/jqha8JCXm0aJ5SJ03Jd0JmGgWRs.jpg,"[18, 36]",895,ru,Андрей Рублёв,"An expansive Russian drama, this film focuses on the life of revered religious icon painter Andrei Rublev. Drifting from place to place in a tumultuous era, the peace-seeking monk eventually gains a reputation for his art. But after Rublev witnesses a brutal battle and unintentionally becomes involved, he takes a vow of silence and spends time away from his work. As he begins to ease his troubled soul, he takes steps towards becoming a painter once again.",3.1089,/910xRIUmNJrWH2hkQifBJtoPp5R.jpg,1966-12-16,Andrei Rublev,False,7.976,883
False,/gkXL5ka6ciU4A4KYSvLIAXtvh7k.jpg,"[53, 18, 27]",10242,en,What Ever Happened to Baby Jane?,A former child star torments her paraplegic sister in their decaying Hollywood mansion.,2.2246,/msGYzyWwtjAaA3DScdgmvJ5MReG.jpg,1962-10-31,What Ever Happened to Baby Jane?,False,7.905,1099
False,/mI7hfScSb8NAWC09viymxCzWZIq.jpg,"[35, 18, 14]",29264,es,El ángel exterminador,"A formal dinner party starts out normally enough, but after the bourgeois group retire to the host’s music room, they inexplicably find themselves unable to leave.",2.6082,/qqZXHvBFxUpo8Pfbyvgh4SYMiWm.jpg,1962-05-16,The Exterminating Angel,False,7.951,696
False,/h1vBJ0uN4QCbBb5WVKxmtfTrHoY.jpg,[37],11697,en,The Man Who Shot Liberty Valance,"Questions arise when Senator Stoddard attends the funeral of a local man named Tom Doniphon in a small Western town. Flashing back, we learn Doniphon saved Stoddard, then a lawyer, when he was roughed up by a crew of outlaws terrorizing the town, led by Liberty Valance. As the territory's safety hung in the balance, Doniphon and Stoddard, two of the only people standing up to him, proved to be very important, but different, foes to Valance.",2.5716,/4C1R0LEivLjbv3swAzJfzh0tzXl.jpg,1962-04-13,The Man Who Shot Liberty Valance,False,7.808,1213
False,/jOulpNwtoJP5fF1LJX1ojw6BxBq.jpg,"[18, 10752]",31442,ru,Иваново детство,"In WW2, twelve year old Soviet orphan Ivan Bondarev works for the Soviet army as a scout behind the German lines and strikes a friendship with three sympathetic Soviet officers.",2.2861,/vmRWSLP1DE9WTta0hfzIafJ0dID.jpg,1962-05-09,Ivan's Childhood,False,7.823,776
False,/7g5v2zXedkwiFqDlWqcoRUUQYD6.jpg,"[18, 28, 35]",11712,ja,椿三十郎,"Toshiro Mifune swaggers and snarls to brilliant comic effect in Kurosawa's tightly paced, beautifully composed ""Sanjuro."" In this companion piece and sequel to ""Yojimbo,"" jaded samurai Sanjuro helps an idealistic group of young warriors weed out their clan's evil influences, and in the process turns their image of a proper samurai on its ear.",2.0776,/zW47oIH3bc3ggmmmzTvKqM4Fqjk.jpg,1962-01-01,Sanjuro,False,7.958,658
False,/pcBIabUibUmpOBggWckkjohXtiP.jpg,"[18, 36]",11656,sv,Jungfrukällan,"Devout Christians Töre and Märeta send their only daughter, the virginal Karin, and their foster daughter, the unrepentant Ingeri, to deliver candles to a distant church. On their way through the woods, the girls encounter a group of savage goat herders who brutally rape and murder Karin as Ingeri remains hidden. When the killers unwittingly seek refuge in the farmhouse of Töre and Märeta, Töre plots a fitting revenge.",1.7838,/z70YM3Y4pNYZATMhFMKonngaeMC.jpg,1960-02-08,The Virgin Spring,False,7.8,631
