adult,backdrop_path,genre_ids,id,original_language,original_title,overview,popularity,poster_path,release_date,title,video,vote_average,vote_count
False,/d84M69u6Q202dm6EvhVxbiqrK9f.jpg,"[12, 18]",334533,en,Captain Fantastic,"Deep in the forests of the Pacific Northwest, a father devoted to raising his six kids with a rigorous physical and intellectual education is forced to leave his paradise and enter the world, beginning a journey that challenges his idea of what it means to be a parent.",3.1323,/2sFME73GaD8UsUxPUKe60cPdLif.jpg,2016-07-08,Captain Fantastic,False,7.893,6582
False,/yB35bWnl0hBsc7bgMrO98d4s3Kj.jpg,"[10749, 18, 10402, 35]",369557,en,Sing Street,A boy growing up in Dublin during the 1980s escapes his strained family life by starting a band to impress the mysterious girl he likes.,1.6447,/sUWpVlrvzU2SJbnVZqIeKulPKwk.jpg,2016-03-11,Sing Street,False,7.861,2360
False,/6G2fLCVm9fiLyHvBrccq6GSe2ih.jpg,"[28, 12, 878]",284053,en,Thor: Ragnarok,"Thor is imprisoned on the other side of the universe and finds himself in a race against time to get back to Asgard to stop Ragnarok, the destruction of his home-world and the end of Asgardian civilization, at the hands of a powerful new threat, the ruthless Hela.",9.4672,/rzRwTcFvttcN1ZpX2xv4j3tSdJu.jpg,2017-10-02,Thor: Ragnarok,False,7.584,21340
False,/yFPaqqXMGsdOKit3fsAJ9tqPJRP.jpg,"[80, 18, 53]",242582,en,Nightcrawler,"When Lou Bloom, desperate for work, muscles into the world of L.A. crime journalism, he blurs the line between observer and participant to become the star of his own story. Aiding him in his effort is Nina, a TV-news veteran.",9.4427,/j9HrX8f7GbZQm1BrBiR40uFQZSb.jpg,2014-10-23,Nightcrawler,False,7.704,11175
False,/agoBZfL1q5G79SD0npArSlJn8BH.jpg,"[35, 10752, 18]",515001,en,Jojo Rabbit,"A World War II satire that follows a lonely German boy whose world view is turned upside down when he discovers his single mother is hiding a young Jewish girl in their attic. Aided only by his idiotic imaginary friend, Adolf Hitler, Jojo must confront his blind nationalism.",5.4611,/1mqL7VG4Ix8wmxwypmCA1HTHBky.jpg,2019-10-18,Jojo Rabbit,False,8.001,9927
False,/hNCqkXbWd40eftqSdjq8TmV7Mqr.jpg,"[18, 878, 9648]",329865,en,Arrival,"Taking place after alien crafts land around the world, an expert linguist is recruited by the military to determine whether they come in peace or are a threat.",9.9913,/x2FJsf1ElAgr63Y3PNPtJrcmpoe.jpg,2016-11-10,Arrival,False,7.617,18476
False,/8BTsTfln4jlQrLXUBquXJ0ASQy9.jpg,"[12, 28, 878]",140607,en,Star Wars: The Force Awakens,"Thirty years after defeating the Galactic Empire, Han Solo and his allies face a new threat from the evil Kylo Ren and his army of Stormtroopers.",9.6944,/wqnLdwVXoBjKibFRR5U3y0aDUhs.jpg,2015-12-15,Star Wars: The Force Awakens,False,7.257,19910
False,/7epLa4lWnfazIVUxExD6DJTLxEI.jpg,"[12, 80, 18, 9648]",196690,en,Before Midnight,A detective tries to figure out who killed a man who predicted his own death.,0.4301,/8mVB3btAMG63kz346XK6zQgD1Sb.jpg,1933-11-18,Before Midnight,False,4.625,8
False,/hUPgIibqZlwbhs4N08cPzzc4f5K.jpg,"[28, 12, 878]",127585,en,X-Men: Days of Future Past,The ultimate X-Men ensemble fights a war for the survival of the species across two time periods as they join forces with their younger selves in an epic battle that must change the past – to save our future.,9.9735,/tYfijzolzgoMOtegh1Y7j2Enorg.jpg,2014-05-15,X-Men: Days of Future Past,False,7.527,15716
False,/213Gdu9zjGsVeWQl6p5gJrBq8n8.jpg,"[18, 80]",74879,tr,Bir Zamanlar Anadolu'da,"A group of men lead a search for a victim of a murder to whom a suspect named Kenan and his mentally challenged brother confessed. However, the search is proving more difficult than expected as Kenan is fuzzy as to the body's location. As the group continues looking, its members can't help but chat among themselves about everyday life, which ultimately leads to conversations about their deepest existential concerns and secrets.",1.2806,/o08n2xyXGTkzKy122TTNat57SHb.jpg,2011-09-23,Once Upon a Time in Anatolia,False,7.481,502
False,/bYimqNnizPUCnL5HOdoCW02IGmH.jpg,"[18, 35, 10749]",74643,fr,The Artist,"Hollywood, 1927: As silent movie star George Valentin wonders if the arrival of talking pictures will cause him to fade into oblivion, he sparks with Peppy Miller, a young dancer set for a big break.",2.4495,/z68py0ZqPgeacGPG54AGVRbNBS7.jpg,2011-10-12,The Artist,False,7.451,3354
False,/4V1yIoAKPMRQwGBaSses8Bp2nsi.jpg,"[28, 878]",137113,en,Edge of Tomorrow,"Major Bill Cage is an officer who has never seen a day of combat when he is unceremoniously demoted and dropped into combat. Cage is killed within minutes, managing to take an alpha alien down with him. He awakens back at the beginning of the same day and is forced to fight and die again... and again - as physical contact with the alien has thrown him into a time loop.",9.2434,/nBM9MMa2WCwvMG4IJ3eiGUdbPe6.jpg,2014-05-27,Edge of Tomorrow,False,7.632,14360
False,/w7Z4BVMin49voNN61IUWyN9DopV.jpg,"[18, 10749]",86837,fr,Amour,"Georges and Anne are in their eighties. They are cultivated, retired music teachers. Their daughter, who is also a musician, lives abroad with her family. One day, Anne has a stroke, and the couple's bond of love is severely tested.",2.0783,/19hyCudualHxCD0GrEngqsi0wBF.jpg,2012-09-20,Amour,False,7.756,1681
False,/1RDto0tLo8Fhq7OcwgDaM7nECb7.jpg,"[80, 18, 36]",398978,en,The Irishman,"Pennsylvania, 1956. Frank Sheeran, a war veteran of Irish origin who works as a truck driver, accidentally meets mobster Russell Bufalino. Once Frank becomes his trusted man, Bufalino sends him to Chicago with the task of helping Jimmy Hoffa, a powerful union leader related to organized crime, with whom Frank will maintain a close friendship for nearly twenty years.",5.8488,/mbm8k3GFhXS0ROd9AD1gqYbIFbM.jpg,2019-11-01,The Irishman,False,7.585,7133
False,/7en9qwF88VfxPXsN6azHmUxRBNy.jpg,"[80, 18]",21575,fr,Un prophète,"Sentenced to six years in prison, Malik El Djebena is alone in the world and can neither read nor write. On his arrival at the prison, he seems younger and more brittle than the others detained there. At once he falls under the sway of a group of Corsicans who enforce their rule in the prison. As the 'missions' go by, he toughens himself and wins the confidence of the Corsican group.",2.4334,/x9Jb8kewBHPzjTtgCQvoQoDsy4d.jpg,2009-08-26,A Prophet,False,7.582,1619
False,/7by1GIdmBJFHKDz1XJWXCmOztmK.jpg,"[878, 18]",17431,en,Moon,"With only three weeks left in his three-year contract, Sam Bell is getting anxious to finally return to Earth. He is the only occupant of a Moon-based manufacturing facility along with his computer and assistant, GERTY. When he has an accident however, he awakens to find that he is not alone.",4.23,/35IU0Mq0zFsN1mYwDGts5mKc77n.jpg,2009-06-12,Moon,False,7.566,5924
False,/49fFaToKnGkZkM0sgIcdaf54A2g.jpg,"[27, 18]",13310,sv,Låt den rätte komma in,"When Oskar, a sensitive, bullied 12-year-old boy, meets his new neighbor, the mysterious and moody Eli, they strike up a friendship. Initially reserved with each other, Oskar and Eli slowly form a close bond, but it soon becomes apparent that she is no ordinary young girl.",3.0508,/7IG4WjaAOVDlLvLUkh513HSwhW8.jpg,2008-10-24,Let the Right One In,False,7.535,3057
False,/jhM3wgWUrrOkz9r4xwV5cV5RhI4.jpg,[878],17654,en,District 9,"Thirty years ago, aliens arrive on Earth. Not to conquer or give aid, but to find refuge from their dying planet. Separated from humans in a South African area called District 9, the aliens are managed by Multi-National United, which is unconcerned with the aliens' welfare but will do anything to master their advanced technology. When a company field agent contracts a mysterious virus that begins to alter his DNA, there is only one place he can hide: District 9.",6.3651,/tuGlQkqLxnodDSk6mp5c2wvxUEd.jpg,2009-08-05,District 9,False,7.454,9862
False,/1liaFFVnxdcUlfvi6Dp29261tK5.jpg,"[18, 35, 10749]",11807,hi,जब वी मेट,A depressed wealthy businessman and a spunky carefree young woman embark on an unexpected journey that changes their lives.,1.4646,/iqiH6vnoEgjAypKsuIScN7JlE2j.jpg,2007-10-26,Jab We Met,False,7.3,286
False,/8RIKOjVKkgjey9Dazti0bQ5rjHW.jpg,"[28, 80, 18]",83038,en,The Wrestler,"Frank Bass (Ed Asner) is an honest guy trying to make a living in the cut throat world of professional wrestling, and he's gonna make it work - even if he dies trying! But first - he'll have to strong-arm his way through all the mobsters, gamblers, promoters and fight fixers and help his past-his-prime wrestler once again win a championship belt. Features appearances from real-life legendary wrestlers and AWA superstars Verne Gagne, Rick Flair, Superstar Billy Graham, Dusty Rhodes, Dick the Bruiser, Ray Stevens, Dory Funk Jr., Ken Patera, Billy Robinson, Dan Gable, Eddie Graham, Dick Murdoch, Vincent J. McMahon, and more.",0.5029,/eTRzi5Wr3vRSD1WcGmqL5B6685l.jpg,1974-04-28,The Wrestler,False,4.2,5
False,/Ac2s9RJEi1ZeaQopoLsqlsmWQmx.jpg,[18],85350,en,Boyhood,"The film tells a story of a divorced couple trying to raise their young son. The story follows the boy for twelve years, from first grade at age 6 through 12th grade at age 17-18, and examines his relationship with his parents as he grows.",3.8093,/2BvtvDUyxiMJ4dmKfiQf4qdOHQN.jpg,2014-06-05,Boyhood,False,7.5,5305
False,/zIWbmU4Q8vTbjkivHRv2isNb60b.jpg,[18],2009,ro,"4 luni, 3 săptămîni și 2 zile",Two college roommates have 24 hours to make the ultimate choice as they finalize arrangements for a black market abortion.,1.1853,/acEtvzFPeOQwbzRWncjRLenhnKV.jpg,2007-08-24,"4 Months, 3 Weeks and 2 Days",False,7.55,763
False,/zzzoRNVSaUv6e1hpADjUDeM3EvY.jpg,"[878, 28, 12]",13475,en,Star Trek,"The fate of the galaxy rests in the hands of bitter rivals. One, James Kirk, is a delinquent, thrill-seeking Iowa farm boy. The other, Spock, a Vulcan, was raised in a logic-based society that rejects all emotion. As fiery instinct clashes with calm reason, their unlikely but powerful partnership is the only thing capable of leading their crew through unimaginable danger, boldly going where no one has gone before. The human adventure has begun again.",7.4982,/lV5OpzAss1z06YNagOVap1I35mH.jpg,2009-05-06,Star Trek,False,7.427,10111
False,/jJh2syzwZDM3cX2UOeDbKUZzuE8.jpg,"[35, 18, 80]",8321,en,In Bruges,"Ray and Ken, two hit men, are in Bruges, Belgium, waiting for their next mission. While they are there they have time to think and discuss their previous assignment. When the mission is revealed to Ken, it is not what he expected.",3.6605,/jMiBBqk72VRo1Y39x2ZbbenEU3a.jpg,2008-02-08,In Bruges,False,7.494,5412
False,/gt4EnUGbbGbNOX0q47YII3WxB48.jpg,"[878, 18]",13363,en,The Man from Earth,"A departing professor gathers his closest colleagues for an intimate farewell, but the night takes an unexpected turn when he shares a stunning secret about his past. As the conversation unfolds, skepticism and curiosity collide, challenging everything they thought they knew about history, science, and belief.",4.8106,/V086R82gNgWrotaXZFO4JhdgB1.jpg,2007-06-10,The Man from Earth,False,7.629,2680
False,/p9V3vD1Ye2zRNfTsE8oY58Fe81S.jpg,"[28, 18, 10752]",1251,en,Letters from Iwo Jima,"The story of the battle of Iwo Jima between the United States and Imperial Japan during World War II, as told from the perspective of the Japanese who fought it.",2.5805,/kZokxQtzMPURvijWYFuvh1fAvnv.jpg,2006-12-09,Letters from Iwo Jima,False,7.5,2136
False,/vNrXoT45xscHY6AN4IGf44vHxVJ.jpg,"[12, 14, 18]",14784,en,The Fall,"In a hospital on the outskirts of 1920s Los Angeles, an injured stuntman begins to tell a fellow patient, a little girl with a broken arm, a fantastic story about 5 mythical heroes. Thanks to his fractured state of mind and her vivid imagination, the line between fiction and reality starts to blur as the tale advances.",5.3606,/jUx4P4Q1VsQ07rLz7sOlSyNm4F3.jpg,2006-09-09,The Fall,False,7.607,1394
False,/21YsCNMub5455NQCn3jh9SmRFyG.jpg,"[12, 18]",87827,en,Life of Pi,"The story of an Indian boy named Pi, a zookeeper's son who finds himself in the company of a hyena, zebra, orangutan, and a Bengal tiger after a shipwreck sets them adrift in the Pacific Ocean.",5.6948,/iLgRu4hhSr6V1uManX6ukDriiSc.jpg,2012-11-20,Life of Pi,False,7.407,13378
False,/xRxSLhhjPG2D8l0BXi0KdN4IvPt.jpg,"[12, 16, 35, 10751]",10315,en,Fantastic Mr. Fox,"The Fantastic Mr. Fox, bored with his current life, plans a heist against the three local farmers. The farmers, tired of sharing their chickens with the sly fox, seek revenge against him and his family.",6.5276,/hhhJN8aJdTlzGmARCbwWflHXhwI.jpg,2009-10-14,Fantastic Mr. Fox,False,7.813,5749
False,/h34IJUeyuQqjHTMbHDKpycw2Eaq.jpg,"[35, 18]",11421,fr,C.R.A.Z.Y.,"A young French Canadian, one of five boys in a conservative family in the 1960s and 1970s, struggles to reconcile his emerging identity with his father's values.",0.8464,/rv1vJgT7uQ5jjAnpNDDoxDzzHX7.jpg,2005-05-27,C.R.A.Z.Y.,False,7.5,477
False,/eWYrrdCKd4bjOKB9DB0HtRUhI1o.jpg,[18],5528,fr,Les Choristes,"In 1940s France, a new teacher at a school for disruptive boys gives hope and inspiration.",3.0485,/hUl7gSvkGygyk9wt3zy5NqpC5bb.jpg,2004-03-17,The Chorus,False,7.729,2500
False,/cyecB7godJ6kNHGONFjUyVN9OX5.jpg,"[28, 878, 12]",1726,en,Iron Man,"After being held captive in an Afghan cave, billionaire engineer Tony Stark creates a unique weaponized suit of armor to fight evil.",17.2156,/78lPtwv72eTNqFW9COBYI0dWDJa.jpg,2008-04-30,Iron Man,False,7.654,27241
False,/wb34q3VgzHgL8frVMywrN3wXmqx.jpg,"[27, 35]",747,en,Shaun of the Dead,"Shaun lives a supremely uneventful life, which revolves around his girlfriend, his mother, and, above all, his local pub. This gentle routine is threatened when the dead return to life and make strenuous attempts to snack on ordinary Londoners.",6.796,/dgXPhzNJH8HFTBjXPB177yNx6RI.jpg,2004-04-09,Shaun of the Dead,False,7.536,8840
False,/kyGrNgAU2PCjzQAPAJsZZEZInh9.jpg,"[18, 10749]",363,de,Gegen die Wand,"With the intention to break free from the strict familial restrictions, a suicidal young woman sets up a marriage of convenience with a forty-year-old addict, an act that will lead to an outburst of envious love.",1.4659,/9L5BBJiXZss58EBcbw0l4holdzZ.jpg,2004-03-11,Head-On,False,7.5,591
False,/4ycpMe25LYpzGW42U9amyW9gM53.jpg,"[53, 80, 18, 9648]",322,en,Mystic River,The lives of three men who were childhood friends are shattered when one of them suffers a family tragedy.,4.7032,/hCHVDbo6XJGj3r2i4hVjKhE0GKF.jpg,2003-10-08,Mystic River,False,7.745,7008
False,/vbk5CfaAHOjQPSAcYm6AoRRz2Af.jpg,"[12, 14]",673,en,Harry Potter and the Prisoner of Azkaban,"Year three at Hogwarts means new fun and challenges as Harry learns the delicate art of approaching a Hippogriff, transforming shape-shifting Boggarts into hilarity and even turning back time. But the term also brings danger: soul-sucking Dementors hover over the school, an ally of the accursed He-Who-Cannot-Be-Named lurks within the castle walls, and fearsome wizard Sirius Black escapes Azkaban. And Harry will confront them all.",22.7598,/aWxwnYoe8p2d2fcxOqtvAtJ72Rw.jpg,2004-05-31,Harry Potter and the Prisoner of Azkaban,False,8.011,22333
False,,[],1223540,en,英雄战警,,0.2232,/wzV5sFPRIM14BCwe0cICxUD6IEt.jpg,2017-01-01,Ying Xiong Zhan Jing,False,0.0,0
False,/9aCRXFWT1rd1nZDcEtWILKb2Sap.jpg,"[18, 10749]",64,es,Hable con ella,Two men share an odd friendship while they care for two women who are both in deep comas.,2.0297,/fWDbQlOWOqjR5jZm98KjGyYmUOw.jpg,2002-03-15,Talk to Her,False,7.579,1357
False,,[35],1247049,en,No Man's Land,,0.0989,,1986-10-24,No Man's Land,False,0.0,0
False,/xNutNK5HUSZO8jzOK5Vksaz44sq.jpg,"[28, 16, 878]",11299,ja,カウボーイビバップ 天国の扉,"The year is 2071. Following a terrorist bombing, a deadly virus is released on the populace of Mars and the government has issued the largest bounty in history, for the capture of whoever is behind it. The bounty hunter crew of the spaceship Bebop; Spike, Faye, Jet and Ed, take the case with hopes of cashing in the bounty. However, the mystery surrounding the man responsible, Vincent, goes deeper than they ever imagined, and they aren't the only ones hunting him.",3.3372,/34H5bsNc0EPILVr49TfOYXj50qV.jpg,2001-09-01,Cowboy Bebop: The Movie,False,7.719,965
False,/kJaRWmy1BGq3pHyE94LOTteiHer.jpg,"[28, 18, 9648, 53]",2501,en,The Bourne Identity,"Wounded to the brink of death and suffering from amnesia, Jason Bourne is rescued at sea by a fisherman. With nothing to go on but a Swiss bank account number, he starts to reconstruct his life, but finds that many people he encounters want him dead. However, Bourne realizes that he has the combat and mental skills of a world-class spy—but who does he work for?",13.6933,/aP8swke3gmowbkfZ6lmNidu0y9p.jpg,2002-06-14,The Bourne Identity,False,7.468,9612
False,/22yIGscWOOLRvwQb44ZboZmstIH.jpg,"[18, 28, 53, 878]",9693,en,Children of Men,"In 2027, in a chaotic world in which humans can no longer procreate, a former activist agrees to help transport a miraculously pregnant woman to a sanctuary at sea, where her child's birth may help scientists save the future of humankind.",5.9135,/8Xgvmx7WWc7Z9Ws9RAYk7uya2kh.jpg,2006-09-22,Children of Men,False,7.612,7405
False,/e4tZvefBtA6P1T0vAPfeXG4Bj3r.jpg,"[80, 53, 18]",18079,es,Nueve reinas,"Two con artists try to swindle a stamp collector by selling him a sheet of counterfeit rare stamps, the ""nine queens"".",1.3698,/tabMRXUTTBmprGax6ON2r9yBN0D.jpg,2000-08-31,Nine Queens,False,7.8,754
False,/xleIwr1wUlWqvFHaU1PItf0YLrZ.jpg,"[18, 10402]",786,en,Almost Famous,"In 1973, 15-year-old William Miller's unabashed love of music and aspiration to become a rock journalist lands him an assignment from Rolling Stone magazine to interview and tour with the up-and-coming band, Stillwater.",4.5366,/3rrkyLYbgLj84AYvjhdcJot4JPx.jpg,2000-09-15,Almost Famous,False,7.501,2909
False,/y1giivdsGLyo1LCvlsL6mLKyTZ7.jpg,"[53, 18, 9648]",1018,en,Mulholland Drive,"Blonde Betty Elms has only just arrived in Hollywood to become a movie star when she meets an enigmatic brunette with amnesia. Meanwhile, as the two set off to solve the second woman's identity, filmmaker Adam Kesher runs into ominous trouble while casting his latest project.",7.2942,/x7A59t6ySylr1L7aubOQEA480vM.jpg,2001-06-06,Mulholland Drive,False,7.807,6616
False,/tPK1kSevALeVGPfDFv1pwyHnoJ9.jpg,"[16, 35, 10751]",863,en,Toy Story 2,"Andy heads off to Cowboy Camp, leaving his toys to their own devices. Things shift into high gear when an obsessive toy collector named Al McWhiggen, owner of Al's Toy Barn kidnaps Woody. Andy's toys mount a daring rescue mission, Buzz Lightyear meets his match and Woody has to decide where he and his heart truly belong.",17.4,/yFWQkz2ynjwsazT6xQiIXEUsyuh.jpg,1999-10-30,Toy Story 2,False,7.602,14315
False,/utbnSk3YMobcfUwmBFDuZIb17Wb.jpg,"[18, 10751]",700145,ja,耳をすませば,"Shizuku Tsukishima is a 3rd grade middle school student. She likes reading books. Shizuku meets Seiji Amasawa who is in the same grade and school that Shizuku attends. At first, she does not like him, but she becomes fascinated with his pursuit of his dream. Seiji also knows Shizuku's dream is to become a novelist. They vow to each other to achieve their dreams. Ten years later, Shizuku gave up her dream of becoming a novelist and now works as an editor for a publishing company that specializes in children's books. She struggles in her daily life at work. Meanwhile, Seiji is abroad and still pursuing his dream.",0.9721,/r2O8iupCOfcf4I2sQm5lv4qApFZ.jpg,2022-10-14,Whisper of the Heart,False,6.2,12
False,/bQEIYntlPba76NN41uWxIzUmzBb.jpg,[18],4995,en,Boogie Nights,"Set in 1977, back when sex was safe, pleasure was a business and business was booming, idealistic porn producer Jack Horner aspires to elevate his craft to an art form. Horner discovers Eddie Adams, a hot young talent working as a busboy in a nightclub, and welcomes him into the extended family of movie-makers, misfits and hangers-on that are always around. Adams' rise from nobody to a celebrity adult entertainer is meteoric, and soon the whole world seems to know his porn alter ego, ""Dirk Diggler"". Now, when disco and drugs are in vogue, fashion is in flux and the party never seems to stop, Adams' dreams of turning sex into stardom are about to collide with cold, hard reality.",6.6204,/6fzz3HkAGJxhGcwRZwpbEZxgZMu.jpg,1997-10-10,Boogie Nights,False,7.632,3299
False,/ninIdXC6iCDKuQRKFJw7nY4uRY2.jpg,[18],527,en,Once Were Warriors,"A drama about a Maori family living in Auckland, New Zealand. Lee Tamahori tells the story of Beth Heke’s strong will to keep her family together during times of unemployment and abuse from her violent and alcoholic husband.",1.521,/1nd4SsytVc96hy92g8NNVPD3mzf.jpg,1994-09-02,Once Were Warriors,False,7.4,453
False,/9lzBxaGXQ2Uy62caE1pzEnDko1h.jpg,"[28, 80, 10749]",319,en,True Romance,"Clarence marries hooker Alabama, steals cocaine from her pimp, and tries to sell it in Hollywood, while the owners of the coke try to reclaim it.",4.7596,/39lXk6ud6KiJgGbbWI2PUKS7y2.jpg,1993-09-09,True Romance,False,7.548,2862
False,/y9N5tFCxCi2AIedOhU3OrVMfL2d.jpg,[18],108,fr,Trois couleurs : Bleu,"The wife of a famous composer survives a car accident that kills her husband and daughter. Now alone, she shakes off her old identity and explores her newfound freedom but finds that she is unbreakably bound to other humans, including her husband’s mistress, whose existence she never suspected.",2.8304,/33wsWxzsNstI8N7dvuwzFmj1qBd.jpg,1993-09-08,Three Colors: Blue,False,7.652,1769
False,/38yjZWYBI0xxNqoBKiGyA4UZjk.jpg,"[80, 18, 53]",6075,en,Carlito's Way,"Free after years in prison, Carlito Brigante intends to give up his criminal ways, but it's not long before the ex-con is sucked back into the New York City underworld. Reconnecting with his dancer girlfriend, Carlito gets entangled in the shady dealings of his friend Dave Kleinfeld, who also serves as his lawyer. An encounter with shifty gangster Benny Blanco sets the duo on a dangerous path.",5.9153,/g6D7mjQtndu768cusGmoEQY9fTB.jpg,1993-11-10,Carlito's Way,False,7.831,3299
False,/aPVeKhD61K3nDiXw5u40sIrD4yS.jpg,"[14, 12, 16, 28]",14282,ja,獣兵衛忍風帖,"Jubei is a masterless ninja who travels the land alone, lending his services to those with gold—or a worthy cause. His fearsome abilities have served him well, but a plot to overthrow the government threatens to end his wandering ways—and possibly his life.",3.2111,/qzZEnaXwv4wss2QalEo4Uf9BAwh.jpg,1993-06-05,Ninja Scroll,False,7.756,683
False,/uNLIMPxknsV4n3IAEDpS1iqF5dm.jpg,"[14, 18, 10749]",162,en,Edward Scissorhands,A small suburban town receives a visit from a castaway unfinished science experiment named Edward.,8.2175,/e0FqKFvGPdQNWG8tF9cZBtev9Em.jpg,1990-12-07,Edward Scissorhands,False,7.718,13283
False,/zjKg04EquTcnVZUfjHboXnXzjcF.jpg,[18],10161,en,My Left Foot: The Story of Christy Brown,"No one expects much from Christy Brown, a boy with cerebral palsy born into a working-class Irish family. Though Christy is a spastic quadriplegic and essentially paralyzed, a miraculous event occurs when, at the age of 5, he demonstrates control of his left foot by using chalk to scrawl a word on the floor. With the help of his steely mother — and no shortage of grit and determination — Christy overcomes his infirmity to become a painter, poet and author.",1.5812,/GRAAl0bMQFoFIjV3aunc5jsM5u.jpg,1989-04-07,My Left Foot: The Story of Christy Brown,False,7.52,962
False,/xDPaSuwaOizRNPitEvNiuY7i6iE.jpg,"[35, 18, 80]",11562,en,Crimes and Misdemeanors,A renowned ophthalmologist is desperate to cut off an adulterous relationship…which ends up in murder; and a frustrated documentary filmmaker woos an attractive television producer while making a film about her insufferably self-centered boss.,1.3272,/6vC6MLYUICH57MmEVi1UaNaj2Qs.jpg,1989-10-13,Crimes and Misdemeanors,False,7.418,907
False,/rMZMcUchb7et72aVSATxhhO6ppM.jpg,"[80, 36, 53]",117,en,The Untouchables,"Elliot Ness, an ambitious prohibition agent, is determined to take down Al Capone. In order to achieve this goal, he forms a group given the nickname “The Untouchables”.",5.7037,/8BquGK22zCcsmBWiaIakaaPpSZb.jpg,1987-06-03,The Untouchables,False,7.758,5899
False,/jx6jUMCLhRWB05ngVjaGxPpLq5x.jpg,"[35, 18]",5143,en,Hannah and Her Sisters,"Between two Thanksgivings, Hannah's husband falls in love with her sister Lee, while her hypochondriac ex-husband rekindles his relationship with her sister Holly.",1.5511,/gARgIRb2QFRFVrsziwWE389u1pK.jpg,1986-02-07,Hannah and Her Sisters,False,7.503,1084
False,/9IYyCLf5NNAQFK9pNtqzEU9HWzM.jpg,"[35, 878]",68,en,Brazil,"Low-level bureaucrat Sam Lowry escapes the monotony of his day-to-day life through a recurring daydream of himself as a virtuous hero saving a beautiful damsel. Investigating a case that led to the wrongful arrest and eventual death of an innocent man instead of wanted terrorist Harry Tuttle, he meets the woman from his daydream, and in trying to help her gets caught in a web of mistaken identities, mindless bureaucracy and lies.",3.0618,/aewan59WcFThBimkTVVoNf2o5Vb.jpg,1985-02-20,Brazil,False,7.7,3469
False,/5OFg2grrAMPo8OOKHQMCeuKU3js.jpg,"[35, 10402]",11031,en,This is Spinal Tap,"""This Is Spinal Tap"" shines a light on the self-contained universe of a metal band struggling to get back on the charts, including everything from its complicated history of ups and downs, gold albums, name changes and undersold concert dates, along with the full host of requisite groupies, promoters, hangers-on and historians, sessions, release events and those special behind-the-scenes moments that keep it all real.",3.5235,/z2LA8eBTSuuPC4NBhIZRNIwpimH.jpg,1984-03-02,This is Spinal Tap,False,7.415,1497
