adult,backdrop_path,genre_ids,id,original_language,original_title,overview,popularity,poster_path,release_date,title,video,vote_average,vote_count
False,/uYRnUnBE4kk5ocvyBckRfMAsZpJ.jpg,"[12, 10749, 10752]",22584,en,To Have and Have Not,A Martinique charter boat skipper gets mixed up with the underground French resistance operatives during WWII.,0.5893,/m9RYIio23yClaO3fy5tcpYac1Gf.jpg,1945-01-20,To Have and Have Not,False,7.471,538
False,/lV4504ucv4Y0AtNMSrlgk7TwiIC.jpg,"[53, 9648]",21734,en,Shadow of a Doubt,"Just when Charlie is feeling especially frustrated by the lack of excitement in her small town in California, she receives wonderful news: Her uncle and namesake, Charlie, is coming to visit. However, as secrets about him come to the fore, her admiration turns into suspicion.",2.1577,/ptyWagbWE8jSGyV2tGEzAdVbRCj.jpg,1943-01-15,Shadow of a Doubt,False,7.503,1079
False,/f8H7cPsumy03oDaztaClookBf0z.jpg,[37],39287,en,Stagecoach,"A group of unlikely travelling companions find themselves on the same stagecoach to Cheyenne. They include a drunken doctor, a bar girl who's been thrown out of town, a professional gambler, a travelling liquor salesman, a banker who has decided to embezzle money, a gun-slinger out for revenge and a young woman going to join her army captain husband. All have secrets but when they are set upon by an Indian war party and then a family of outlaws, they find they must all work together if they are to stay alive.",1.589,/wsifrzutFIzt51FLVDbWW5AOTUG.jpg,1966-04-21,Stagecoach,False,6.144,45
False,/bOKIpYOm5WSeMCI6nGHWbEavCER.jpg,"[9648, 53, 35, 10749]",4706,en,The Lady Vanishes,"On the eve of World War II, zany heiress Amanda Kelly travels by train to Switzerland. While passing through Germany, she meets a sweet elderly lady, who suddenly vanishes. Distraught, she questions her fellow passengers who claim that the woman was never there. Unsure if it's all in her mind or if there's a more sinister plot afoot, Amanda teams up with photographer Robert Condon to discover the truth.",1.814,/xw0GhX9M3zjbFd7OeYdNHrmZSiH.jpg,1979-04-30,The Lady Vanishes,False,6.038,65
False,/fzJgCQh2NBnUYlms8EGyr4bPNz3.jpg,"[35, 10749]",900,en,Bringing Up Baby,"David Huxley is waiting to get a bone he needs for his museum collection. Through a series of strange circumstances, he meets Susan Vance, and the duo have a series of misadventures which include a leopard called Baby.",2.8139,/vTNNOtemaYmtx3k2NpsLMRJKEwZ.jpg,1938-02-18,Bringing Up Baby,False,7.53,1020
False,/hrED8MSOn4xJP9Cpk7WomUcFKGI.jpg,"[27, 878]",229,en,Bride of Frankenstein,"Dr. Frankenstein and his monster both turn out to be alive, not killed as previously believed. Dr. Frankenstein wants to get out of the evil experiment business, but when a mad scientist, Dr. Pretorius, kidnaps his wife, Dr. Frankenstein agrees to help him create a new creature.",1.7098,/5241zUwe7rC17MNc2QpCBKKdp1N.jpg,1935-04-20,Bride of Frankenstein,False,7.505,1033
False,/3i6H4cVfvWh55sN1iXyeb8Q50nY.jpg,"[80, 18]",877,en,Scarface,"In 1920s Chicago, Italian immigrant and notorious thug, Antonio 'Tony' Camonte, aka Scarface, shoots his way to the top of the mobs while trying to protect his sister from the criminal life.",3.0,/y4E5oRiHMTFkEB12IIcpbKbKzDW.jpg,1932-04-09,Scarface,False,7.451,633
False,/nVpp3ZcIFtJJ3fJp65eJczehIN8.jpg,"[35, 10752]",3063,en,Duck Soup,Rufus T. Firefly is named president/dictator of bankrupt Freedonia and declares war on neighboring Sylvania over the love of wealthy Mrs. Teasdale.,1.7015,/31t63plEGKHhYuuCpC9bFWO9SBS.jpg,1933-11-12,Duck Soup,False,7.298,815
False,/9VK9ahBhqG0aKGhohACN465juxp.jpg,"[27, 878, 10770]",3042,en,Frankenstein,"In the early 19th century, Dr. Frankenstein discovers the secret of life – how to create a perfect man – powerful, intelligent and immune to disease. But something goes wrong in the laboratory and the doctor’s hideous creation disappears into the night. At first, Frankenstein hoped that the horrible monster would perish in the wilderness, but now he senses that it’s alive and sets out for him. Dr. Frankenstein tracks the creature to the Arctic, where the two must battle to decide who will become the master of the other’s life…or death.",0.6616,/osjlYkk2dIJvbOHTwghboKWfl8k.jpg,1993-12-02,Frankenstein,False,6.816,19
False,/uYkQYnrAz8Gzw6WCmcFEAzhlJIA.jpg,[18],426426,es,Roma,"In 1970s Mexico City, two domestic workers help a mother of four while her husband is away for an extended period of time.",2.0918,/dtIIyQyALk57ko5bjac7hi01YQ.jpg,2018-11-21,Roma,False,7.629,3986
False,/65BrpnfNIDTb0zAeAi7EVm4cf7W.jpg,"[53, 18]",269820,ml,ഗോഡ്സ് Own Country,"Manu travels from Dubai to Kochi to attain his goal, without which he will be in trouble. Public prosecutor Mathew Tharakan and taxi driver Muhammed have their own intentions to be pursued as well. Vasudeva Sanal's God's Own Country narrates the story of what happens to the three as they try to reach their destination.",0.3836,/2uw4AZqUXVat8NdAhUJV1lGTRXO.jpg,2014-05-09,God's Own Country,False,5.4,7
False,/sGtXDnT08Nkb5NQq2oGD3os1zg9.jpg,"[28, 35, 12]",383498,en,Deadpool 2,Wisecracking mercenary Deadpool battles the evil and powerful Cable and other bad guys to save a boy's life.,11.6078,/to0spRl1CMDvyUbOnbb4fTk3VAd.jpg,2018-05-15,Deadpool 2,False,7.489,18559
False,/kQGxGXzYiCumY8kmXXpgbZyZQK8.jpg,"[80, 9648, 53]",395834,en,Wind River,An FBI agent teams with the town's veteran game tracker to investigate a murder that occurred on a Native American reservation.,4.5507,/pySivdR845Hom4u4T2WNkJxe6Ad.jpg,2017-08-03,Wind River,False,7.434,5454
False,/bBQHALHRAaaORlPNXv7fNcRXYdx.jpg,"[9648, 53, 27]",419430,en,Get Out,"Chris and his girlfriend Rose go upstate to visit her parents for the weekend. At first, Chris reads the family's overly accommodating behavior as nervous attempts to deal with their daughter's interracial relationship, but as the weekend progresses, a series of increasingly disturbing discoveries lead him to a truth that he never could have imagined.",8.0489,/tFXcEccSQMf3lfhfXKSU9iRBpa3.jpg,2017-02-24,Get Out,False,7.618,18062
False,/aWNknDl5kGZTgjqfeIKxdZaKGmm.jpg,"[35, 18]",348678,sv,En man som heter Ove,"Despite being deposed as president of his condominium association, grumpy 59-year-old Ove continues to watch over his neighbourhood with an iron fist. When pregnant Parvaneh and her family move into the terraced house opposite Ove and she accidentally back into Ove’s mailbox, it sets off a series of unexpected changes in his life.",2.2783,/a41uvFqze4PI7N3E9jPNwN9ypV.jpg,2015-12-25,A Man Called Ove,False,7.6,1221
False,/utjThRtcnsj0GrDwNudjGdfmHfq.jpg,"[35, 27]",246741,en,What We Do in the Shadows,Vampire housemates try to cope with the complexities of modern life and show a newly turned hipster some of the perks of being undead.,1.7841,/a2rD3i3DBMeYbA34rBv6z3B9S3a.jpg,2014-06-19,What We Do in the Shadows,False,7.56,3698
False,/3IzR3VhZAyhxVnuRRUHFLkfK4hT.jpg,"[28, 12]",353081,en,Mission: Impossible - Fallout,"When an IMF mission ends badly, the world is faced with dire consequences. As Ethan Hunt takes it upon himself to fulfill his original briefing, the CIA begin to question his loyalty and his motives. The IMF team find themselves in a race against time, hunted by assassins while trying to prevent a global catastrophe.",20.139,/AkJQpZp9WoNdj7pLYSj1L0RcMMN.jpg,2018-07-25,Mission: Impossible - Fallout,False,7.441,8674
False,/86l1gqKjhPn6Ypd8XSSIGx7ZikB.jpg,"[16, 18, 10751, 9648]",242828,ja,思い出のマーニー,"Upon being sent to live with relatives in the countryside due to an illness, an emotionally distant adolescent girl becomes obsessed with an abandoned mansion and infatuated with a girl who lives there - a girl who may or may not be real.",3.2159,/vug1dvDI1tSa60Z8qjCuUE7ntkO.jpg,2014-07-19,When Marnie Was There,False,7.932,1873
False,/ke3lanTAgCqPMpOyutIfXzYih2s.jpg,"[18, 10749]",266856,en,The Theory of Everything,"The Theory of Everything is the extraordinary story of one of the world’s greatest living minds, the renowned astrophysicist Stephen Hawking, who falls deeply in love with fellow Cambridge student Jane Wilde.",6.2362,/kJuL37NTE51zVP3eG5aGMyKAIlh.jpg,2014-11-07,The Theory of Everything,False,7.84,10796
False,/qzUIOTk0E3F1zjvYjcBRTKUTgf9.jpg,"[80, 35, 28, 12]",207703,en,Kingsman: The Secret Service,The story of a super-secret spy organization that recruits an unrefined but promising street kid into the agency's ultra-competitive training program just as a global threat emerges from a twisted tech genius.,10.8584,/r6q9wZK5a2K51KFj4LWVID6Ja1r.jpg,2015-01-24,Kingsman: The Secret Service,False,7.624,17236
False,/22l5YKpMHBeh0o4uHQ079Y19PPg.jpg,"[10749, 18]",222935,en,The Fault in Our Stars,"Despite the tumor-shrinking medical miracle that has bought her a few years, Hazel has never been anything but terminal, her final chapter inscribed upon diagnosis. But when a patient named Augustus Waters suddenly appears at Cancer Kid Support Group, Hazel's story is about to be completely rewritten.",6.2239,/kcVuktIlrn9SAN1uBmPDnocTQmF.jpg,2014-05-16,The Fault in Our Stars,False,7.596,11326
False,/4sOeeDX9uBteu81ty2bcdbzU933.jpg,"[18, 35]",308369,en,Me and Earl and the Dying Girl,"Greg is coasting through senior year of high school as anonymously as possible, avoiding social interactions like the plague while secretly making spirited, bizarre films with Earl, his only friend. But both his anonymity and friendship threaten to unravel when his mother forces him to befriend a classmate with leukemia.",1.5975,/eLjS2bLMjln2n2I73Xu6TaANPDZ.jpg,2015-06-12,Me and Earl and the Dying Girl,False,7.528,2633
False,/bEmPrq7Y4MubVATOCtOacY3eXQ5.jpg,"[10749, 18]",152584,fr,La Vie d'Adèle - Chapitres 1 et 2,"Adèle's life is changed when she meets Emma, a young woman with blue hair, who will allow her to discover desire, to assert herself as a woman and as an adult. In front of others, Adele grows, seeks herself, loses herself, finds herself.",4.543,/kgUk1wti2cvrptIgUz0VTAtSF6w.jpg,2013-10-09,Blue Is the Warmest Color,False,7.073,4700
False,/s0OrExdg7i3RLR7oqzHRk4q2kL4.jpg,"[18, 35]",194662,en,Birdman or (The Unexpected Virtue of Ignorance),"A fading actor best known for his portrayal of a popular superhero attempts to mount a comeback by appearing in a Broadway play. As opening night approaches, his attempts to become more altruistic, rebuild his career, and reconnect with friends and family prove more difficult than expected.",8.4658,/rHUg2AuIuLSIYMYFgavVwqt1jtc.jpg,2014-10-17,Birdman or (The Unexpected Virtue of Ignorance),False,7.452,13135
False,/gjoZgt6jErl2p3VXIzBvvZY7Taw.jpg,[18],137182,nl,The Broken Circle Breakdown,The loss of their young daughter threatens to destroy the love and faith of two married musicians.,1.3148,/qXpMmQaKvTCCN2tvzvkyuOp8AQC.jpg,2012-10-09,The Broken Circle Breakdown,False,7.7,1084
False,/3UseBwzKsUmMN37XcahJSVYRWkf.jpg,"[18, 10402, 10749]",79464,hi,Rockstar,"College student Janardhan is a simpleton who desperately seeks inspiration for the musician inside him. Although heartbreak helps him reach his goal, it also leads him to self-destruction.",1.9826,/cJZC9riwrdATBUonkZJZD6y9g40.jpg,2011-11-11,Rockstar,False,7.3,200
False,/1RWLMyC9KcFfcaoViMiJGSSZzzr.jpg,"[28, 12, 878]",100402,en,Captain America: The Winter Soldier,"After the cataclysmic events in New York with The Avengers, Steve Rogers, aka Captain America is living quietly in Washington, D.C. and trying to adjust to the modern world. But when a S.H.I.E.L.D. colleague comes under attack, Steve becomes embroiled in a web of intrigue that threatens to put the world at risk. Joining forces with the Black Widow, Captain America struggles to expose the ever-widening conspiracy while fighting off professional assassins sent to silence him at every turn. When the full scope of the villainous plot is revealed, Captain America and the Black Widow enlist the help of a new ally, the Falcon. However, they soon find themselves up against an unexpected and formidable enemy—the Winter Soldier.",7.3299,/tVFRpFw3xTedgPGqxW0AOI8Qhh0.jpg,2014-03-20,Captain America: The Winter Soldier,False,7.655,19354
False,/yePsFcldyZ6VnxaBr8ZbVEaOt4W.jpg,"[18, 12]",129670,en,Nebraska,"An aging, booze-addled father takes a trip from Montana to Nebraska with his estranged son in order to claim what he believes to be a million-dollar sweepstakes prize.",1.6812,/o1t2Mw18EEBnl8v4Nby3PFjxnM1.jpg,2013-09-21,Nebraska,False,7.448,1823
False,/3IFRjBDwtk0DlIsDfJ2zEzLjUBi.jpg,"[10751, 16, 35, 12]",82690,en,Wreck-It Ralph,"Wreck-It Ralph is the 9-foot-tall, 643-pound villain of an arcade video game named Fix-It Felix Jr., in which the game's titular hero fixes buildings that Ralph destroys. Wanting to prove he can be a good guy and not just a villain, Ralph escapes his game and lands in Hero's Duty, a first-person shooter where he helps the game's hero battle against alien invaders. He later enters Sugar Rush, a kart racing game set on tracks made of candies, cookies and other sweets. There, Ralph meets Vanellope von Schweetz who has learned that her game is faced with a dire threat that could affect the entire arcade, and one that Ralph may have inadvertently started.",9.0159,/zWoIgZ7mgmPkaZjG0102BSKFIqQ.jpg,2012-11-01,Wreck-It Ralph,False,7.348,12650
False,,[],570403,fr,Le petit prince,"After an engine failure, an airman finds himself lost in the Sahara desert. He thinks he is desperately alone... until he hears a small voice asking him: ""Please, draw me a sheep"".",0.1164,/eLBymtliaSS5bldLW7Nz8e0163.jpg,1990-12-23,Le petit prince,False,6.0,1
False,/aU6Mj8yFZhOnTpXjobqcwrB4KPP.jpg,[18],74308,en,Detachment,"A chronicle of three weeks in the lives of several high school teachers, administrators and students through the eyes of substitute teacher, Henry Barthes. Henry roams from school to school, imparting modes of knowledge, but never staying long enough to form any semblance of sentient attachment.",5.0385,/23iYUrdUJ70tbNYU81hVhmTuYJ0.jpg,2011-04-24,Detachment,False,7.6,1814
False,/sIJTdyF6JFbIz5mENPpeSlCKYyB.jpg,"[14, 35, 10749]",59436,en,Midnight in Paris,"While on a trip to Paris with his fiancée's family, a nostalgic screenwriter finds himself mysteriously going back to the 1920s every day at midnight.",2.9934,/4wBG5kbfagTQclETblPRRGihk0I.jpg,2011-05-11,Midnight in Paris,False,7.522,7471
False,/uvtQQMCMR50e8Ahs6RRpOrAYk1Y.jpg,[18],168245,hi,कई पो छे!,Three friends growing up in India at the turn of the millennium set out to open a training academy to produce the country's next cricket stars.,2.9679,/cAlv5vmDXzpVmTCk4DmggUbW7cd.jpg,2013-02-13,Kai Po Che!,False,7.029,136
False,/5N2mfRrvJUnCVpsMIebfosEyo1i.jpg,"[16, 10751, 12, 35, 14]",137106,en,The Lego Movie,"An ordinary Lego mini-figure, mistakenly thought to be the extraordinary MasterBuilder, is recruited to join a quest to stop an evil Lego tyrant from conquering the universe.",8.3727,/lbctonEnewCYZ4FYoTZhs8cidAl.jpg,2014-02-06,The Lego Movie,False,7.42,8105
False,/k3PqsPLkKLDyjZupZ6gqZHPxMv3.jpg,"[28, 12, 878]",54138,en,Star Trek Into Darkness,"When the crew of the Enterprise is called back home, they find an unstoppable force of terror from within their own organization has detonated the fleet and everything it stands for, leaving our world in a state of crisis.  With a personal score to settle, Captain Kirk leads a manhunt to a war-zone world to capture a one man weapon of mass destruction. As our heroes are propelled into an epic chess game of life and death, love will be challenged, friendships will be torn apart, and sacrifices must be made for the only family Kirk has left: his crew.",6.6482,/7XrRkhMa9lQ71RszzSyVrJVvhyS.jpg,2013-05-05,Star Trek Into Darkness,False,7.32,9320
False,/npFPqZeHlEPOlLEpykP6kuSsi6v.jpg,"[878, 53, 18]",49047,en,Gravity,"Dr. Ryan Stone, a brilliant medical engineer, is on her first Shuttle mission, with veteran astronaut Matt Kowalsky in command of his last flight before retiring. But on a seemingly routine spacewalk, disaster strikes. The Shuttle is destroyed, leaving Stone and Kowalsky completely alone-tethered to nothing but each other and spiraling out into the blackness of space. The deafening silence tells them they have lost any link to Earth and any chance for rescue. As fear turns to panic, every gulp of air eats away at what little oxygen is left. But the only way home may be to go further out into the terrifying expanse of space.",6.8085,/kZ2nZw8D681aphje8NJi8EfbL1U.jpg,2013-10-03,Gravity,False,7.162,15741
False,/cq9N64ucEtfIc3eMxNr1VzY9LH9.jpg,[18],37799,en,The Social Network,"In 2003, Harvard undergrad and computer programmer Mark Zuckerberg begins work on a new concept that eventually turns into the global social network known as Facebook. Six years later, Mark is one of the youngest billionaires ever, but his unprecedented success leads to both personal and legal complications when he ends up on the receiving end of two lawsuits, one involving his former friend.",8.2813,/n0ybibhJtQ5icDqTp8eRytcIHJx.jpg,2010-10-01,The Social Network,False,7.369,12591
False,/qJj3Qy19FzboB6BI0RSZ07bIDiT.jpg,"[18, 10752]",283587,en,Beasts of No Nation,"Based on the experiences of Agu, a child fighting in the civil war of an unnamed, fictional West African country. Follows Agu's journey as he's forced to join a group of soldiers. While he fears his commander and many of the men around him, his fledgling childhood has been brutally shattered by the war raging through his country, and he is at first torn between conflicting revulsion and fascination.",1.7865,/1D4vcJmJc58WXarpRtwgd2do9Rg.jpg,2015-09-11,Beasts of No Nation,False,7.592,1784
False,/zXVledoXBJnYyrwdSLvnYmhgJXy.jpg,"[99, 10770]",691677,en,X-Men: First Class 35mm Special,"TV special about the making of ""X-Men: First Class"".",0.8733,/gionQv04AWnRaDMNvBF24uJMSTf.jpg,2012-06-05,X-Men: First Class 35mm Special,False,6.724,29
False,/mgcbG1w3lgj9lajGBXVUjLQti8P.jpg,"[28, 12, 53]",37724,en,Skyfall,"When Bond's latest assignment goes gravely wrong, agents around the world are exposed and MI6 headquarters is attacked. While M faces challenges to her authority and position from Gareth Mallory, the new Chairman of the Intelligence and Security Committee, it's up to Bond, aided only by field agent Eve, to locate the mastermind behind the attack.",8.954,/d0IVecFQvsGdSbnMAHqiYsNYaJT.jpg,2012-10-24,Skyfall,False,7.252,15567
False,/iuRVt8tFiXDPGgzavhuSa3QHRxD.jpg,[35],18785,en,The Hangover,"When three friends finally come to after a raucous night of bachelor-party revelry, they find a baby in the closet and a tiger in the bathroom. But they can't seem to locate their best friend, Doug – who's supposed to be tying the knot. Launching a frantic search for Doug, the trio perseveres through a nasty hangover to try to make it to the church on time.",19.9182,/A0uS9rHR56FeBtpjVki16M5xxSW.jpg,2009-06-02,The Hangover,False,7.326,17436
False,/92Ppi99LkZFHUgpxwYRxcKZVZNH.jpg,"[18, 35, 10749]",82693,en,Silver Linings Playbook,"After losing his job and wife, and spending time in an institution, a former teacher winds up living with his parents. He wants to rebuild his life and reconcile with his wife, but his father would be happy if he shared his obsession with the Philadelphia Eagles. Things get complicated when he meets Tiffany Maxwell who offers to help him reconnect with his wife if he will do something very important for her in exchange.",4.7781,/y7iOVneBvITlBdhy6tVqXVOa1Js.jpg,2012-11-16,Silver Linings Playbook,False,7.146,12247
False,/iVk4mVKwNE66JbBcoDwcYFvuUXM.jpg,"[18, 53]",68734,en,Argo,"As the Iranian revolution reaches a boiling point, a CIA 'exfiltration' specialist concocts a risky plan to free six Americans who have found shelter at the home of the Canadian ambassador.",6.5918,/m5gPWFZFIp4UJFABgWyLkbXv8GX.jpg,2012-10-11,Argo,False,7.281,8566
False,/1M2i4Mxd03elGOTmEkIvqrHfmyS.jpg,"[35, 18, 10749]",19913,en,(500) Days of Summer,"Tom, greeting-card writer and hopeless romantic, is caught completely off-guard when his girlfriend, Summer, suddenly dumps him. He reflects on their 500 days together to try to figure out where their love affair went sour, and in doing so, Tom rediscovers his true passions in life.",8.278,/qXAuQ9hF30sQRsXf40OfRVl0MJZ.jpg,2009-07-17,(500) Days of Summer,False,7.297,10544
False,/shqLeIkqPAAXM8iT6wVDiXUYz1p.jpg,"[16, 14, 10751]",12429,ja,崖の上のポニョ,"When Sosuke, a young boy who lives on a clifftop overlooking the sea, rescues a stranded goldfish named Ponyo, he discovers more than he bargained for. Ponyo is a curious, energetic young creature who yearns to be human, but even as she causes chaos around the house, her father, a powerful sorcerer, schemes to return Ponyo to the sea.",6.1992,/yp8vEZflGynlEylxEesbYasc06i.jpg,2008-07-19,Ponyo,False,7.749,4524
False,/20wSDAS6rUWhkZQ2PxPC9TRsAd1.jpg,"[18, 36]",11499,en,Frost/Nixon,"For three years after being forced from office, Nixon remained silent. But in summer 1977, the steely, cunning former commander-in-chief agreed to sit for one all-inclusive interview to confront the questions of his time in office and the Watergate scandal that ended his presidency. Nixon surprised everyone in selecting Frost as his televised confessor, intending to easily outfox the breezy British showman and secure a place in the hearts and minds of Americans. Likewise, Frost's team harboured doubts about their boss's ability to hold his own. But as the cameras rolled, a charged battle of wits resulted.",1.8851,/z4cQ2mJxwPZUwVh97yX9oNsLLZQ.jpg,2008-10-15,Frost/Nixon,False,7.276,1228
False,/AqLcLsGGTzAjm3pCCq0CZCQrp6m.jpg,"[12, 14]",12444,en,Harry Potter and the Deathly Hallows: Part 1,"Harry, Ron and Hermione walk away from their last year at Hogwarts to find and destroy the remaining Horcruxes, putting an end to Voldemort's bid for immortality. But with Harry's beloved Dumbledore dead and Voldemort's unscrupulous Death Eaters on the loose, the world is more dangerous than ever.",18.9294,/iGoXIpQb7Pot00EEdwpwPajheZ5.jpg,2010-11-17,Harry Potter and the Deathly Hallows: Part 1,False,7.739,19684
False,/3fgcEjBNrhstYgPlG1c8WT7UpIN.jpg,"[16, 878, 53]",4977,ja,パプリカ,"When a machine that allows therapists to enter their patient's dreams is stolen, all hell breaks loose. Only a young female therapist can stop it and recover it before damage is done: Paprika.",5.7536,/bLUUr474Go1DfeN1HLjE3rnZXBq.jpg,2006-10-01,Paprika,False,7.815,2633
False,/eBmIaAm1CkBuuyIUQYorhQKzTTg.jpg,"[80, 18, 9648]",3580,en,Changeling,"Los Angeles, 1928. When single mother Christine Collins leaves for work, her son vanishes without a trace. Five months later, the police reunite mother and son. But when Christine suspects that the boy returned to her isn't her child, her quest for truth exposes a world of corruption.",3.5648,/y9Qi39dL3PceGCH8afyC7QrhbhI.jpg,2008-10-24,Changeling,False,7.584,4303
False,/xBSwwkAYl9h8QVG2OxNpSaSgJwr.jpg,"[10749, 18]",43949,en,Flipped,"When Juli meets Bryce in the second grade, she knows it's true love. After spending six years trying to convince Bryce the same, she's ready to give up - until he starts to reconsider.",5.1029,/6zDYFigohwncqFL00MKbFV01dWb.jpg,2010-08-06,Flipped,False,8.023,3165
False,/3c59KMNs2MYqXUb2GZe8Yfwn4kb.jpg,"[14, 16, 18, 878]",14069,ja,時をかける少女,"When 17-year-old Makoto Konno gains the ability to, quite literally, 'leap' backwards through time, she immediately sets about improving her grades and preventing personal mishaps. However, she soon realises that changing the past isn't as simple as it seems, and eventually, will have to rely on her new powers to shape the future of herself and her friends.",2.7746,/xHnlWM8BmqY419YUccYy2KC5Jqo.jpg,2006-07-15,The Girl Who Leapt Through Time,False,7.783,2108
False,/o8HOv12JGZ0YyetTbxkla0S1o6Q.jpg,"[14, 9648, 53]",16007,ja,デスノート,"Light Yagami finds the ""Death Note,"" a notebook with the power to kill, and decides to create a Utopia by killing the world's criminals, and soon the world's greatest detective, ""L,"" is hired to find the mysterious murderer. An all out battle between the two greatest minds on earth begins and the winner will control the world.",2.8202,/xiJPZntaz1BMooXfiwi2iZAMbhY.jpg,2006-06-17,Death Note,False,7.068,731
False,/7ldtxkVW93dTVKRrA2Fe0CSl0S1.jpg,"[18, 80]",11798,en,This Is England,"A story about a troubled boy growing up in England, set in 1983. He comes across a few skinheads on his way home from school, after a fight. They become his new best friends, even like family. Based on experiences of director Shane Meadows.",0.6474,/bmhVn89BoAAIziFklH3TusE26H0.jpg,2007-04-27,This Is England,False,7.475,1324
False,/uqOuJ50EtTj7kkDIXP8LCg7G45D.jpg,"[18, 878]",264660,en,Ex Machina,"Caleb, a coder at the world's largest internet company, wins a competition to spend a week at a private mountain retreat belonging to Nathan, the reclusive CEO of the company. But when Caleb arrives at the remote location he finds that he will have to participate in a strange and fascinating experiment in which he must interact with the world's first true artificial intelligence, housed in the body of a beautiful robot girl.",6.3099,/dmJW8IAKHKxFNiUnoDR7JfsK7Rp.jpg,2015-01-21,Ex Machina,False,7.572,13661
False,/c2nxaEE0yBcg9qeqrisbkvBxTNh.jpg,[18],3549,da,Efter brylluppet,"A manager of an orphanage in India is sent to Copenhagen, Denmark, where he discovers a life-altering family secret.",1.2446,/29t5x0Aj4cQJJC9jNR3VWS7l3JL.jpg,2006-02-24,After the Wedding,False,7.129,445
